Course Name,URL
The Complete Python Bootcamp From Zero to Hero in Python,https://www.udemy.com/course/complete-python-bootcamp/
The Complete 2023 Web Development Bootcamp,https://www.udemy.com/course/the-complete-web-development-bootcamp/
The Web Developer Bootcamp 2023,https://www.udemy.com/course/the-web-developer-bootcamp/
Try Udemy Business,https://www.udemy.com/udemy-business/request-demo-mx/?ref=right-rail&locale=en_US
100 Days of Code: The Complete Python Pro Bootcamp for 2023,https://www.udemy.com/course/100-days-of-code/
React - The Complete Guide 2023 (incl. React Router & Redux),https://www.udemy.com/course/react-the-complete-guide-incl-redux/
Angular - The Complete Guide (2023 Edition),https://www.udemy.com/course/the-complete-guide-to-angular-2/
Java Programming Masterclass updated to Java 17,https://www.udemy.com/course/java-the-complete-java-developer-course/
The Complete JavaScript Course 2023: From Zero to Expert!,https://www.udemy.com/course/the-complete-javascript-course/
"Machine Learning A-Z™: AI, Python & R + ChatGPT Bonus [2023]",https://www.udemy.com/course/machinelearning/
Python for Data Science and Machine Learning Bootcamp,https://www.udemy.com/course/python-for-data-science-and-machine-learning-bootcamp/
The Data Science Course: Complete Data Science Bootcamp,https://www.udemy.com/course/the-data-science-course-complete-data-science-bootcamp/
Automate the Boring Stuff with Python Programming,https://www.udemy.com/course/automate/
Selenium WebDriver with Java -Basics to Advanced+Frameworks,https://www.udemy.com/course/selenium-real-time-examplesinterview-questions/
Complete C# Unity Game Developer 2D,https://www.udemy.com/course/unitycourse/
Learn Python Programming Masterclass,https://www.udemy.com/course/python-the-complete-python-developer-course/
Build Responsive Real-World Websites with HTML and CSS,https://www.udemy.com/course/design-and-develop-a-killer-website-with-html5-and-css3/
iOS & Swift - The Complete iOS App Development Bootcamp,https://www.udemy.com/course/ios-13-app-development-bootcamp/
The Ultimate MySQL Bootcamp: Go from SQL Beginner to Expert,https://www.udemy.com/course/the-ultimate-mysql-bootcamp-go-from-sql-beginner-to-expert/
Modern React with Redux [2023 Update],https://www.udemy.com/course/react-redux/
Try Udemy Business,https://www.udemy.com/udemy-business/request-demo-mx/?ref=right-rail&locale=en_US
"[NEW] Spring Boot 3, Spring 6 & Hibernate for Beginners",https://www.udemy.com/course/spring-hibernate-tutorial/
The Complete Web Developer Course 3.0,https://www.udemy.com/course/the-complete-web-developer-course-2/
The Complete Node.js Developer Course (3rd Edition),https://www.udemy.com/course/the-complete-nodejs-developer-course-2/
Unreal Engine 5 C++ Developer: Learn C++ & Make Video Games,https://www.udemy.com/course/unrealcourse/
Flutter & Dart - The Complete Guide [2023 Edition],https://www.udemy.com/course/learn-flutter-dart-to-build-ios-android-apps/
C# Basics for Beginners: Learn C# Fundamentals by Coding,https://www.udemy.com/course/csharp-tutorial-for-beginners/
"Python Mega Course: Learn Python in 60 Days, Build 20 Apps",https://www.udemy.com/course/the-python-mega-course/
The Complete Web Developer in 2023: Zero to Mastery,https://www.udemy.com/course/the-complete-web-developer-zero-to-mastery/
Beginning C++ Programming - From Beginner to Beyond,https://www.udemy.com/course/beginning-c-plus-plus-programming/
Vue - The Complete Guide (incl. Router & Composition API),https://www.udemy.com/course/vuejs-2-the-complete-guide/
Docker Mastery: with Kubernetes +Swarm from a Docker Captain,https://www.udemy.com/course/docker-mastery/
Docker and Kubernetes: The Complete Guide,https://www.udemy.com/course/docker-and-kubernetes-the-complete-guide/
R Programming A-Z™: R For Data Science With Real Exercises!,https://www.udemy.com/course/r-programming/
Complete Python Developer in 2023: Zero to Mastery,https://www.udemy.com/course/complete-python-developer-zero-to-mastery/
The Complete Flutter Development Bootcamp with Dart,https://www.udemy.com/course/flutter-bootcamp-with-dart/
Python and Django Full Stack Web Developer Bootcamp,https://www.udemy.com/course/python-and-django-full-stack-web-developer-bootcamp/
Try Udemy Business,https://www.udemy.com/udemy-business/request-demo-mx/?ref=right-rail&locale=en_US
The Python Bible™ | Everything You Need to Program in Python,https://www.udemy.com/course/the-python-bible/
JavaScript: Understanding the Weird Parts,https://www.udemy.com/course/understand-javascript/
SQL for Beginners: Learn SQL using MySQL and Database Design,https://www.udemy.com/course/sql-for-beginners-course/
Master Microservices with Spring Boot and Spring Cloud,https://www.udemy.com/course/microservices-with-spring-boot-and-spring-cloud/
Understanding TypeScript,https://www.udemy.com/course/understanding-typescript/
"Deep Learning A-Z™ 2023: Neural Networks, AI & ChatGPT Bonus",https://www.udemy.com/course/deeplearning/
The Complete React Native + Hooks Course,https://www.udemy.com/course/the-complete-react-native-and-redux-course/
"NodeJS - The Complete Guide (MVC, REST APIs, GraphQL, Deno)",https://www.udemy.com/course/nodejs-the-complete-guide/
"Advanced CSS and Sass: Flexbox, Grid, Animations and More!",https://www.udemy.com/course/advanced-css-and-sass/
Mastering Data Structures & Algorithms using C and C++,https://www.udemy.com/course/datastructurescncpp/
Complete C# Unity Game Developer 3D,https://www.udemy.com/course/unitycourse2/
Apache Kafka Series - Learn Apache Kafka for Beginners v3,https://www.udemy.com/course/apache-kafka/
Statistics for Data Science and Business Analysis,https://www.udemy.com/course/statistics-for-data-science-and-business-analysis/
Python for Beginners: Learn Python Programming (Python 3),https://www.udemy.com/course/python-programming-projects/
Java Programming for Complete Beginners,https://www.udemy.com/course/java-programming-tutorial-for-beginners/
HTML and CSS for Beginners - Build a Website & Launch ONLINE,https://www.udemy.com/course/html-and-css-for-beginners-crash-course-learn-fast-easy/
Try Udemy Business,https://www.udemy.com/udemy-business/request-demo-mx/?ref=right-rail&locale=en_US
React Native - The Practical Guide [2023],https://www.udemy.com/course/react-native-the-practical-guide/
Go: The Complete Developer's Guide (Golang),https://www.udemy.com/course/go-the-complete-developers-guide/
"C# Intermediate: Classes, Interfaces and OOP",https://www.udemy.com/course/csharp-intermediate-classes-interfaces-and-oop/
Data Science A-Z™: Hands-On Exercises & ChatGPT Bonus [2023],https://www.udemy.com/course/datascience/
The Complete ASP.NET MVC 5 Course,https://www.udemy.com/course/the-complete-aspnet-mvc-5-course/
Master the Coding Interview: Data Structures + Algorithms,https://www.udemy.com/course/master-the-coding-interview-data-structures-algorithms/
"DevOps , CI/CD(Continuous Integration/Delivery for Beginners",https://www.udemy.com/course/ci-cd-devops/
Rest API Testing (Automation) from Scratch-Rest Assured Java,https://www.udemy.com/course/rest-api-automation-testing-rest-assured/
Learn JIRA with real-world examples (+Confluence bonus),https://www.udemy.com/course/the-complete-guide-to-jira-with-real-world-examples/
Modern JavaScript From The Beginning 2.0 - 2023 Revamp,https://www.udemy.com/course/modern-javascript-from-the-beginning/
C Programming For Beginners - Master the C Language,https://www.udemy.com/course/c-programming-for-beginners-/
Relational Database Design,https://www.udemy.com/course/relational-database-design/
JavaScript Basics for Beginners,https://www.udemy.com/course/javascript-basics-for-beginners/
Python for Absolute Beginners,https://www.udemy.com/course/python-for-absolute-beginners-u/
"Machine Learning, Data Science and Deep Learning with Python",https://www.udemy.com/course/data-science-and-machine-learning-with-python-hands-on/
The Modern Python 3 Bootcamp,https://www.udemy.com/course/the-modern-python3-bootcamp/
Try Udemy Business,https://www.udemy.com/udemy-business/request-demo-mx/?ref=right-rail&locale=en_US
Learn and Understand NodeJS,https://www.udemy.com/course/understand-nodejs/
The Complete Android N Developer Course,https://www.udemy.com/course/complete-android-n-developer-course/
"Git Complete: The definitive, step-by-step guide to Git",https://www.udemy.com/course/git-complete/
Alteryx Bootcamp,https://www.udemy.com/course/alteryx-bootcamp/
JavaScript - The Complete Guide 2023 (Beginner + Advanced),https://www.udemy.com/course/javascript-the-complete-guide-2020-beginner-advanced/
"Complete React Developer in 2023 (w/ Redux, Hooks, GraphQL)",https://www.udemy.com/course/complete-react-developer-zero-to-mastery/
The Complete Angular Course: Beginner to Advanced,https://www.udemy.com/course/the-complete-angular-master-class/
Python A-Z™: Python For Data Science With Real Exercises!,https://www.udemy.com/course/python-coding/
Complete C# Masterclass,https://www.udemy.com/course/complete-csharp-masterclass/
Kubernetes Certified Application Developer (CKAD) with Tests,https://www.udemy.com/course/certified-kubernetes-application-developer/
Ethereum and Solidity: The Complete Developer's Guide,https://www.udemy.com/course/ethereum-and-solidity-the-complete-developers-guide/
Modern HTML & CSS From The Beginning (Including Sass),https://www.udemy.com/course/modern-html-css-from-the-beginning/
Artificial Intelligence A-Z™ 2023: Build an AI with ChatGPT4,https://www.udemy.com/course/artificial-intelligence-az/
Responsive Web Design: HTML5 + CSS3 for Entrepreneurs 2018,https://www.udemy.com/course/html-css-more/
The Complete Java Certification Course,https://www.udemy.com/course/master-practical-java-development/
JavaScript Algorithms and Data Structures Masterclass,https://www.udemy.com/course/js-algorithms-and-data-structures-masterclass/
Try Udemy Business,https://www.udemy.com/udemy-business/request-demo-mx/?ref=right-rail&locale=en_US
Microsoft SQL for Beginners,https://www.udemy.com/course/microsoft-sql-for-beginners/
PHP for Beginners - Become a PHP Master - CMS Project,https://www.udemy.com/course/php-for-complete-beginners-includes-msql-object-oriented/
Angular & NodeJS - The MEAN Stack Guide [2023 Edition],https://www.udemy.com/course/angular-2-and-nodejs-the-practical-guide/
The Complete Python Programming Course: Beginner to Advanced,https://www.udemy.com/course/python-complete/
The Complete 2023 Software Testing Bootcamp,https://www.udemy.com/course/testerbootcamp/
Python for beginners,https://www.udemy.com/course/python-core-and-advanced/
The Complete React Developer Course (w/ Hooks and Redux),https://www.udemy.com/course/react-2nd-edition/
Learn C++ Programming -Beginner to Advance- Deep Dive in C++,https://www.udemy.com/course/cpp-deep-dive/
MongoDB - The Complete Developer's Guide 2023,https://www.udemy.com/course/mongodb-the-complete-developers-guide/
Spark and Python for Big Data with PySpark,https://www.udemy.com/course/spark-and-python-for-big-data-with-pyspark/
Java In-Depth: Become a Complete Java Engineer!,https://www.udemy.com/course/java-in-depth-become-a-complete-java-engineer/
Become a WordPress Developer: Unlocking Power With Code,https://www.udemy.com/course/become-a-wordpress-developer-php-javascript/
Learn and Understand AngularJS,https://www.udemy.com/course/learn-angularjs/
Learn How To Code: Google's Go (golang) Programming Language,https://www.udemy.com/course/learn-how-to-code/
Build an app with ASPNET Core and Angular from scratch,https://www.udemy.com/course/build-an-app-with-aspnet-core-and-angular-from-scratch/
C# Advanced Topics: Prepare for Technical Interviews,https://www.udemy.com/course/csharp-advanced/
Try Udemy Business,https://www.udemy.com/udemy-business/request-demo-mx/?ref=right-rail&locale=en_US
REST APIs with Flask and Python in 2023,https://www.udemy.com/course/rest-api-flask-and-python/
Docker & Kubernetes: The Practical Guide [2023 Edition],https://www.udemy.com/course/docker-kubernetes-the-practical-guide/
The Complete Python Course | Learn Python by Doing in 2023,https://www.udemy.com/course/the-complete-python-course/
Data Analysis with Pandas and Python,https://www.udemy.com/course/data-analysis-with-pandas/
Complete Guide to Elasticsearch,https://www.udemy.com/course/elasticsearch-complete-guide/
Git Going Fast: One Hour Git Crash Course,https://www.udemy.com/course/git-going-fast/
"Node.js, Express, MongoDB & More: The Complete Bootcamp 2023",https://www.udemy.com/course/nodejs-express-mongodb-bootcamp/
Learning Python for Data Analysis and Visualization Ver 1,https://www.udemy.com/course/learning-python-for-data-analysis-and-visualization/
Spring Framework 5: Beginner to Guru,https://www.udemy.com/course/spring-framework-5-beginner-to-guru/
The Ultimate Guide to Game Development with Unity (Official),https://www.udemy.com/course/the-ultimate-guide-to-game-development-with-unity/
"Understanding Jira for users, managers and admins",https://www.udemy.com/course/introduction-to-jira/
The Git & Github Bootcamp,https://www.udemy.com/course/git-and-github-bootcamp/
Angular Crash Course for Busy Developers,https://www.udemy.com/course/angular-crash-course/
Learn Python & Ethical Hacking From Scratch,https://www.udemy.com/course/learn-python-and-ethical-hacking-from-scratch/
MasterClass Software Testing with Jira & Agile -Be a QA Lead,https://www.udemy.com/course/learn-software-testing-in-practical-become-a-qa-expert/
The Complete Oracle SQL Bootcamp (2023),https://www.udemy.com/course/oracle-sql-12c-become-an-sql-developer-with-subtitle/
Try Udemy Business,https://www.udemy.com/udemy-business/request-demo-mx/?ref=right-rail&locale=en_US
The Complete Android Oreo Developer Course - Build 23 Apps!,https://www.udemy.com/course/the-complete-android-oreo-developer-course/
Appium -Mobile Testing (Android/IOS) from Scratch+Frameworks,https://www.udemy.com/course/mobile-automation-using-appiumselenium-3/
The Agile Samurai Bootcamp,https://www.udemy.com/course/the-agile-samurai-bootcamp/
Complete Machine Learning & Data Science Bootcamp 2023,https://www.udemy.com/course/complete-machine-learning-and-data-science-zero-to-mastery/
Python for Financial Analysis and Algorithmic Trading,https://www.udemy.com/course/python-for-finance-and-trading-algorithms/
Apache Spark with Scala - Hands On with Big Data!,https://www.udemy.com/course/apache-spark-with-scala-hands-on-with-big-data/
Selenium 4 WebDriver with Java(Basics + Advance + Architect),https://www.udemy.com/course/selenium-training/
Complete Guide to TensorFlow for Deep Learning with Python,https://www.udemy.com/course/complete-guide-to-tensorflow-for-deep-learning-with-python/
Bootstrap 4 From Scratch With 5 Projects,https://www.udemy.com/course/bootstrap-4-from-scratch-with-5-projects/
The Ultimate Excel Programmer Course,https://www.udemy.com/course/ultimate-excel-programmer/
Javascript for Beginners Learn by Doing Practical Exercises,https://www.udemy.com/course/javascript-for-beginners-introduction-learn-fast-easy/
Data Science and Machine Learning Bootcamp with R,https://www.udemy.com/course/data-science-and-machine-learning-bootcamp-with-r/
WebServices/Rest API Testing with SoapUI +Real time Projects,https://www.udemy.com/course/webservices-testing-with-soap-ui/
"Ionic - Build iOS, Android & Web Apps with Ionic & Angular",https://www.udemy.com/course/ionic-2-the-practical-guide-to-building-ios-android-apps/
Bash Scripting and Shell Programming (Linux Command Line),https://www.udemy.com/course/bash-scripting/
Learn JMETER from Scratch on Live Apps -Performance Testing,https://www.udemy.com/course/learn-jmeter-from-scratch-performance-load-testing-tool/
Try Udemy Business,https://www.udemy.com/udemy-business/request-demo-mx/?ref=right-rail&locale=en_US
Microservices with Node JS and React,https://www.udemy.com/course/microservices-with-node-js-and-react/
Java Programming: Complete Beginner to Advanced,https://www.udemy.com/course/java-programming-complete-beginner-to-advanced/
Learn DevOps: CI/CD with Jenkins using Pipelines and Docker,https://www.udemy.com/course/learn-devops-ci-cd-with-jenkins-using-pipelines-and-docker/
The Complete Ruby on Rails Developer Course,https://www.udemy.com/course/the-complete-ruby-on-rails-developer-course/
"Jenkins, From Zero To Hero: Become a DevOps Jenkins Master",https://www.udemy.com/course/jenkins-from-zero-to-hero/
"MERN Stack Front To Back: Full Stack React, Redux & Node.js",https://www.udemy.com/course/mern-stack-front-to-back/
Postman: The Complete Guide - REST API Testing,https://www.udemy.com/course/postman-the-complete-guide/
Selenium Webdriver with PYTHON from Scratch + Frameworks,https://www.udemy.com/course/learn-selenium-automation-in-easy-python-language/
Taming Big Data with Apache Spark and Python - Hands On!,https://www.udemy.com/course/taming-big-data-with-apache-spark-hands-on/
Docker Crash Course for busy DevOps and Developers,https://www.udemy.com/course/docker-tutorial-for-devops-run-docker-containers/
Learn HTML5 Programming From Scratch,https://www.udemy.com/course/learn-html5-programming-from-scratch/
The Complete WordPress Website Business Course,https://www.udemy.com/course/the-complete-wordpress-website-business-course/
Data Structures and Algorithms: Deep Dive Using Java,https://www.udemy.com/course/data-structures-and-algorithms-deep-dive-using-java/
Node with React: Fullstack Web Development,https://www.udemy.com/course/node-with-react-fullstack-web-development/
SOLID Principles: Introducing Software Architecture & Design,https://www.udemy.com/course/solid-design/
NLP - Natural Language Processing with Python,https://www.udemy.com/course/nlp-natural-language-processing-with-python/
Try Udemy Business,https://www.udemy.com/udemy-business/request-demo-mx/?ref=right-rail&locale=en_US
"GitLab CI: Pipelines, CI/CD and DevOps for Beginners",https://www.udemy.com/course/gitlab-ci-pipelines-ci-cd-and-devops-for-beginners/
The Coding Interview Bootcamp: Algorithms + Data Structures,https://www.udemy.com/course/coding-interview-bootcamp-algorithms-and-data-structure/
Ultimate Web Designer & Web Developer Course,https://www.udemy.com/course/web-developer-course/
Learn DevOps: Infrastructure Automation With Terraform,https://www.udemy.com/course/learn-devops-infrastructure-automation-with-terraform/
Core Java Made Easy (Covers the latest Java 17),https://www.udemy.com/course/corejavamadeeasy/
The Complete Front-End Web Development Course,https://www.udemy.com/course/front-end-web-development/
Master Java Web Services and REST API with Spring Boot,https://www.udemy.com/course/spring-web-services-tutorial/
iOS 10 & Swift 3: From Beginner to Paid Professional™,https://www.udemy.com/course/devslopes-ios10/
Learn Spring Boot 3 in 100 Steps - No 1 Java Framework,https://www.udemy.com/course/spring-boot-tutorial-for-beginners/
Build Websites from Scratch with HTML & CSS,https://www.udemy.com/course/build-website-scratch/
ES6 Javascript: The Complete Developer's Guide,https://www.udemy.com/course/javascript-es6-tutorial/
Introduction to Machine Learning for Data Science,https://www.udemy.com/course/machine-learning-for-data-science/
Learn JAVA Programming - Beginner to Master,https://www.udemy.com/course/java-se-programming/
Scala & Functional Programming Essentials | Rock the JVM,https://www.udemy.com/course/rock-the-jvm-scala-for-beginners/
"The Complete PL/SQL Bootcamp : ""Beginner to Advanced PL/SQL""",https://www.udemy.com/course/plsql-beginner-to-advanced-become-a-perfect-plsql-developer/
AWS Serverless APIs & Apps - A Complete Introduction,https://www.udemy.com/course/aws-serverless-a-complete-introduction/
Try Udemy Business,https://www.udemy.com/udemy-business/request-demo-mx/?ref=right-rail&locale=en_US
JavaScript: The Advanced Concepts (2023 Update),https://www.udemy.com/course/advanced-javascript-concepts/
Entity Framework in Depth: The Complete Guide,https://www.udemy.com/course/entity-framework-tutorial/
The Modern JavaScript Bootcamp,https://www.udemy.com/course/modern-javascript/
"DevOps: CI/CD with Jenkins pipelines, Maven, Gradle",https://www.udemy.com/course/devops-and-continuous-integration-with-jenkins-pipelines/
Python for Machine Learning & Data Science Masterclass,https://www.udemy.com/course/python-for-machine-learning-data-science-masterclass/
Next.js & React - The Complete Guide (incl. Two Paths!),https://www.udemy.com/course/nextjs-react-the-complete-guide/
PHP with Laravel for beginners - Become a Master in Laravel,https://www.udemy.com/course/php-with-laravel-for-beginners-become-a-master-in-laravel/
Complete UiPath RPA Developer Course: Build 7 Robots,https://www.udemy.com/course/complete-uipath-rpa-developer-course/
Quick Introduction to Postman and API Testing for Beginners,https://www.udemy.com/course/postman-crash-course-for-beginners-learn-rest-api-testing/
Cypress -Modern Automation Testing from Scratch + Frameworks,https://www.udemy.com/course/cypress-tutorial/
Selenium WebDriver with Java for beginners,https://www.udemy.com/course/selenium-for-beginners/
Learn to Code in Python 3: Programming beginner to advanced,https://www.udemy.com/course/learn-python-programming-a-step-by-step-course-to-beginners/
"Beginner Full Stack Web Development: HTML, CSS, React & Node",https://www.udemy.com/course/ultimate-web/
Typescript: The Complete Developer's Guide,https://www.udemy.com/course/typescript-the-complete-developers-guide/
AWS CloudFormation Master Class v2 [2022],https://www.udemy.com/course/aws-cloudformation-master-class/
.NET Core MVC - The Complete Guide 2023 [E-commerce app],https://www.udemy.com/course/complete-aspnet-core-21-course/
Try Udemy Business,https://www.udemy.com/udemy-business/request-demo-mx/?ref=right-rail&locale=en_US
Data Science: Natural Language Processing (NLP) in Python,https://www.udemy.com/course/data-science-natural-language-processing-in-python/
Node.js: The Complete Guide to Build RESTful APIs (2018),https://www.udemy.com/course/nodejs-master-class/
The Modern Javascript Bootcamp Course (2022),https://www.udemy.com/course/javascript-beginners-complete-tutorial/
Programming with Python : HandsOn Introduction for Beginners,https://www.udemy.com/course/python-programming-beginners/
The Complete Android 12 & Kotlin Development Masterclass,https://www.udemy.com/course/android-kotlin-developer/
Pre-Programming: Everything you need to know before you code,https://www.udemy.com/course/pre-programming-everything-you-need-to-know-before-you-code/
"Python for Data Structures, Algorithms, and Interviews!",https://www.udemy.com/course/python-for-data-structures-algorithms-and-interviews/
"JSP, Servlets and JDBC for Beginners: Build a Database App",https://www.udemy.com/course/jsp-tutorial/
Microservices: Designing Highly Scalable Systems,https://www.udemy.com/course/introduction-to-microservices/
Design Patterns in C# and .NET,https://www.udemy.com/course/design-patterns-csharp-dotnet/
Unreal Engine 4: How to Develop Your First Two Games,https://www.udemy.com/course/unreale4/
Advanced React and Redux,https://www.udemy.com/course/react-redux-tutorial/
Statistics for Business Analytics and Data Science A-Z™,https://www.udemy.com/course/data-statistics/
GitHub Ultimate: Master Git and GitHub - Beginner to Expert,https://www.udemy.com/course/github-ultimate/
The Complete iOS 10 & Swift 3 Developer Course,https://www.udemy.com/course/complete-ios-10-developer-course/
RPG Core Combat Creator: Learn Intermediate Unity C# Coding,https://www.udemy.com/course/unityrpg/
Try Udemy Business,https://www.udemy.com/udemy-business/request-demo-mx/?ref=right-rail&locale=en_US
Progressive Web Apps (PWA) - The Complete Guide,https://www.udemy.com/course/progressive-web-app-pwa-the-complete-guide/
Bash Shell Scripting: Crash Course For Beginners,https://www.udemy.com/course/bash-shell-scripting-crash-course-for-beginners/
C++: From Beginner to Expert,https://www.udemy.com/course/video-course-c-from-beginner-to-expert/
Android Java Masterclass - Become an App Developer,https://www.udemy.com/course/master-android-7-nougat-java-app-development-step-by-step/
"50 Projects In 50 Days - HTML, CSS & JavaScript",https://www.udemy.com/course/50-projects-50-days/
Practice Java by Building Projects,https://www.udemy.com/course/practice-java-by-building-projects/
ISTQB Foundation Level Complete Training,https://www.udemy.com/course/foundation-level-training/
Ethereum Blockchain Developer Bootcamp With Solidity (2023),https://www.udemy.com/course/blockchain-developer/
"Modern JavaScript (Complete guide, from Novice to Ninja)",https://www.udemy.com/course/modern-javascript-from-novice-to-ninja/
Robot Framework Test Automation - Level 1 ( Selenium ),https://www.udemy.com/course/robot-framework-level-1/
Master Hibernate and JPA with Spring Boot in 100 Steps,https://www.udemy.com/course/hibernate-jpa-tutorial-for-beginners-in-100-steps/
"React, NodeJS, Express & MongoDB - The MERN Fullstack Guide",https://www.udemy.com/course/react-nodejs-express-mongodb-the-mern-fullstack-guide/
Python 3: Deep Dive (Part 1 - Functional),https://www.udemy.com/course/python-3-deep-dive-part-1/
GraphQL with React: The Complete Developers Guide,https://www.udemy.com/course/graphql-with-react-course/
Unit Testing for C# Developers,https://www.udemy.com/course/unit-testing-csharp/
Selenium WebDriver 4 With Java - Novice To Ninja + Interview,https://www.udemy.com/course/selenium-webdriver-with-java-testng-and-log4j/
Try Udemy Business,https://www.udemy.com/udemy-business/request-demo-mx/?ref=right-rail&locale=en_US
Xamarin Forms: Build Native Cross-platform Apps with C#,https://www.udemy.com/course/xamarin-forms-course/
