Course Name,URL
Master Bootstrap 4 (4.6.0) and code 7 projects with 25 pages,https://www.udemy.com/course/bootstrap-4-responsive-web-design-and-development/
Leaflet for Beginners,https://www.udemy.com/course/leaflet-for-beginners/
Practical Office 365 Administration,https://www.udemy.com/course/practical-office-365-administration/
C# Basics for Beginners: Introduction to Programming with C#,https://www.udemy.com/course/c-sharp-introduction/
Data Science with Python (beginner to expert),https://www.udemy.com/course/data-science-with-python-certification-training/
Refactoring Pyramid explained in simple steps (Java),https://www.udemy.com/course/pyramid-of-refactoring-java-interpreter-factories/
Python GUI Programming using Tkinter and Python 3,https://www.udemy.com/course/python-gui-programming-using-tkinter-and-python-3/
The Complete Angular 5 Essentials Course For Beginners,https://www.udemy.com/course/angular5/
Salesforce Real time project on Lightning Component(AURA),https://www.udemy.com/course/salesforce-real-time-project-with-lightning-component/
Deploy Serverless Machine Learning Models to AWS Lambda,https://www.udemy.com/course/deploy-serverless-machine-learning-models-to-aws-lambda/
Deploy Serverless Machine Learning Models to AWS Lambda,https://www.udemy.com/course/deploy-serverless-machine-learning-models-to-aws-lambda/
Agile Software Testing,https://www.udemy.com/course/agile-software-testing/
Master The Java Programming Language,https://www.udemy.com/course/java-tutorial-by-sagar/
Try Udemy Business,https://www.udemy.com/udemy-business/request-demo-mx/?ref=right-rail&locale=en_US
Apple Watch Programming for iOS Developers - WatchOS 3 Apps,https://www.udemy.com/course/apple-watch-programming-for-ios-developers-watchos-3-apps-watchkit/
Laravel Multi User Blogging Platform with SEO (2 projects),https://www.udemy.com/course/learn-laravel-php-framework-building-multi-user-seo-blog-app/
Introduction to Computer Science,https://www.udemy.com/course/introduction-to-computer-science/
Asynchronous JavaScript Deep Dive,https://www.udemy.com/course/asynchronous-javascript-deep-dive/
Mastering SharePoint 2013 Development Using C# - Part II,https://www.udemy.com/course/sharepoint2013developmentpart2/
90 Minute Contact Manager in FileMaker Pro,https://www.udemy.com/course/90-minute-contact-manager/
C++ Programming MADE EASY : A Concise C++ Course,https://www.udemy.com/course/c-programming-made-easy-a-concise-c-course/
QA manual testing from the beginning,https://www.udemy.com/course/qa-manual-testing-from-the-beginning/
Working with WebSockets in Go (Golang),https://www.udemy.com/course/working-with-websockets-in-go/
Coding Interview Preparation - The Softer Skills,https://www.udemy.com/course/software-engineer-interview-preparation/
Angular 8 Certification Training (basic to advanced level),https://www.udemy.com/course/angular-8-certification-training/
Raspberry Pi: Make a Workbench Computer,https://www.udemy.com/course/raspberrypibc/
Complete Android Developer Course - Android 11 with Java,https://www.udemy.com/course/complete-android-course/
Python Interactive Dashboards with Plotly Dash (new version),https://www.udemy.com/course/python-interactive-dashboards-with-plotly-dash/
Learn Automation with Geb and Spock,https://www.udemy.com/course/learn-automation-with-geb-and-spock/
Learn C++ Programming Mini Course - Power of Animation,https://www.udemy.com/course/learn-c-programming-mini-course-power-of-animation/
Try Udemy Business,https://www.udemy.com/udemy-business/request-demo-mx/?ref=right-rail&locale=en_US
Practical Python: Learn Python Basics Step by Step- Python 3,https://www.udemy.com/course/practical-python-3/
Learn Python 3 from scratch to become a developer in demand,https://www.udemy.com/course/learn-python-3-from-scratch/
Java Programming – the Master Course,https://www.udemy.com/course/java-programming-the-master-course/
PHP with MySQL- Procedural Part,https://www.udemy.com/course/php-with-mysql-procedrual-part/
WebRTC Practical Course. Create Video Chat Application,https://www.udemy.com/course/webrtc-2021-practical-course-create-meet-the-strangers-app/
Create Simple GUI Applications with Python and Qt,https://www.udemy.com/course/create-simple-gui-applications-with-python-and-qt/
SQL Server SSAS (Tabular) - Analysis Services & DAX,https://www.udemy.com/course/sql-server-ssas-tabular-analysis-services-dax/
The Complete Unity 5 Intro - Learn to Build and Design Games,https://www.udemy.com/course/3dmotive-the-complete-unity-5-intro-learn-to-build-and-design-games/
An Absolute Beginner's Guide To Linux!,https://www.udemy.com/course/a-beginners-guide-to-linux-system-administration/
Short Programming intro in Python and C++,https://www.udemy.com/course/basic-python-cpp/
Node.js Certification Training,https://www.udemy.com/course/nodejs-certification-training/
Reflections and Annotation in Java Uncomplicated,https://www.udemy.com/course/reflections-and-annotation-in-java-uncomplicated/
Next JS & Typescript with Shopify Integration - Full Guide,https://www.udemy.com/course/next-js-typescript-with-shopify-integration-full-guide/
Level Up Discord Bot Nodejs Development 2023,https://www.udemy.com/course/how-to-quickly-create-a-discord-bot/
Next JS & Typescript with Shopify Integration - Full Guide,https://www.udemy.com/course/next-js-typescript-with-shopify-integration-full-guide/
A/B Testing in Python,https://www.udemy.com/course/ab-testing-in-python/
Try Udemy Business,https://www.udemy.com/udemy-business/request-demo-mx/?ref=right-rail&locale=en_US
HTML and CSS for Beginners From Basic to Advance,https://www.udemy.com/course/html-and-css-for-beginners-from-basic-to-advance/
MySQL Database Admin -DBA for Beginners,https://www.udemy.com/course/mysql-database-admin-dba-for-beginners/
The Complete Strapi Course - with plugins and deployment,https://www.udemy.com/course/strapi-course/
Python for Beginners: The Complete Python Masterclass,https://www.udemy.com/course/exploring-python/
"JUnit 5, Mockito, PowerMock, TDD, BDD & ATTD",https://www.udemy.com/course/testing-for-developers/
One-stop Ruby on Rails: Build Web Applications from Scratch,https://www.udemy.com/course/build-etsy-yelp-craigslist-and-a-web-scraper-from-scratch/
Learn Python 3 From Scratch,https://www.udemy.com/course/learn-python-of-angular-from-scratch/
Database Programming with Python,https://www.udemy.com/course/database-programming-with-python/
Selenium Automation: a complete package,https://www.udemy.com/course/selenium-webdriver-with-maven-jenkins-git-cucumber/
Introduction to Data Structures & Algorithms,https://www.udemy.com/course/introduction-to-data-structures-algorithms/
Complete beginners introduction to web development,https://www.udemy.com/course/learn-web-development-basics-a-beginners-introduction/
Algorithms for Job Interviews and Competitive Programming,https://www.udemy.com/course/algorithms-for-job-interviews-and-competitive-programming/
Complete iOS Bootcamp - Swift & Objective-C,https://www.udemy.com/course/complete-ios-bootcamp/
Hands-On Guide to Argo Workflows on Kubernetes,https://www.udemy.com/course/hands-on-guide-to-argo-workflows-on-kubernetes/
Microsoft Azure Cognitive Services Crash Course,https://www.udemy.com/course/azure-cognitive-services-crash-course/
Build amazing real desktop application by javaFx,https://www.udemy.com/course/build-amazing-real-desktop-application-by-javafx/
Try Udemy Business,https://www.udemy.com/udemy-business/request-demo-mx/?ref=right-rail&locale=en_US
Creating powerful API's with Django Rest Framework on Heroku,https://www.udemy.com/course/powerful-apis-django-rest-framework/
"Python training, from scratch to penetration tester",https://www.udemy.com/course/python-training-from-scratch-to-penetration-tester/
Data Science Mega-Course: #Build {120-Projects In 120-Days},https://www.udemy.com/course/real-world-data-science-projects-using-python/
Introduction to World Machine,https://www.udemy.com/course/introduction-to-world-machine/
Deploying web apps for new developers on AWS ec2,https://www.udemy.com/course/deploying-web-apps-simplified-quick-or-in-depth-on-aws/
Unity Multiplayer UNET Build Online Shooter . Code included,https://www.udemy.com/course/unity-multiplayer-make-a-shooter-game-code-included/
Upgrade from JSP to Thymeleaf with SpringMVC and Spring Boot,https://www.udemy.com/course/become-a-thymeleaf-master-with-spring-mvc-and-spring-boot/
Unity Game Development Master Class,https://www.udemy.com/course/unity-game-development-master-class/
Unity: Particles from beginner to advanced!,https://www.udemy.com/course/unity-particles-from-beginner-to-advanced/
Learn CI/CD YAML pipelines with Azure DevOps,https://www.udemy.com/course/learn-cicd-yaml-pipelines-with-azure-devops/
Complete php mysql course - Learn php mysql and php oop,https://www.udemy.com/course/php-mysqli-tutorials/
ASP.NET Core Web API - Zero to Hero [ASP.Net Core 5.0],https://www.udemy.com/course/restful-web-api-with-aspnet-core-5-zero-to-hero/
"Python: Coding Guidelines, Tools, Tests and Packages [2023]",https://www.udemy.com/course/python-coding-guidelines-tooling-testing-and-packaging/
Python Design Patterns,https://www.udemy.com/course/python-design-patterns/
Accelerated Regular Expressions Training - Regex,https://www.udemy.com/course/accelerated-regular-expressions-training/
Writing High Performance Python,https://www.udemy.com/course/writing-high-performance-python/
Try Udemy Business,https://www.udemy.com/udemy-business/request-demo-mx/?ref=right-rail&locale=en_US
Make Python Programs with ChatGPT with Zero Coding Skills,https://www.udemy.com/course/turn-ideas-into-python-programs-with-chatgpt/
Lambda with Functional Programming in Java8,https://www.udemy.com/course/lambda-with-functional-programming-in-java/
Linear Regression and Logistic Regression using R Studio,https://www.udemy.com/course/linear-regression-and-logistic-regression-r-studio-starttech/
Object-Oriented Programming (OOP) - Learn to Code Faster,https://www.udemy.com/course/object-oriented-programming-with-python-learn-to-code-faster/
Introduction to Domain Names & Web Hosting(Free Domain Name),https://www.udemy.com/course/free-3-domain-names/
OpenAPI (Swagger) Specification for Software Developers,https://www.udemy.com/course/openapi-swagger-specification/
Python GUI and Gaming 101 with Tkinter,https://www.udemy.com/course/pythongui/
Making an Action-Adventure Game Using GameMaker,https://www.udemy.com/course/gamemakerstudio2/
Typescript & React JS Course with React & Typescript Project,https://www.udemy.com/course/typescript-react-js-course-with-react-typescript-project/
Create POS System - Inventory & sales with PHP 7 & adminLTE,https://www.udemy.com/course/create-pos-system-inventory-sales-with-php7-adminlte/
Azure Functions Masterclass,https://www.udemy.com/course/azure-functions-masterclass/
CSS Grid & Flexbox - The Ultimate Course Build +10 Projects,https://www.udemy.com/course/css-grid-flexbox-the-ultimate-course-build-10-projects/
"Advanced WordPress Gutenberg Blocks, Post Types & Taxonomies",https://www.udemy.com/course/advanced-wordpress-topics-post-types-taxonomies-metaboxes/
The Ultimate Beginners Guide to Natural Language Processing,https://www.udemy.com/course/the-ultimate-beginners-guide-to-natural-language-processing/
"JSON with Java APIs, jQuery and JSON REST Web Services",https://www.udemy.com/course/learn-json-with-java-apis-jquery-and-rest/
Object Orientation in PHP,https://www.udemy.com/course/object-orientation/
Try Udemy Business,https://www.udemy.com/udemy-business/request-demo-mx/?ref=right-rail&locale=en_US
NestJS - Building Real Project API From Scratch,https://www.udemy.com/course/nestjs-building-real-project-api-from-scratch/
Pass The Certified Blockchain Developer Exam - Ethereum CBDE,https://www.udemy.com/course/ethereum-blockchain-certification/
Flutter & Dart Bootcamp-Getting Started Complete Guide 2022,https://www.udemy.com/course/flutterbootcamp/
Learn Python for beginners,https://www.udemy.com/course/learn-python-for-beginners/
Master CI/CD for iOS Developers,https://www.udemy.com/course/continuous-integration-and-continuous-delivery-for-ios-developers/
The Complete Unity 5 Guide: Unity Game Development Made Easy,https://www.udemy.com/course/build-your-dream-game-learn-unity-course/
Learn Bash Shell in Linux for Beginners,https://www.udemy.com/course/learn-bash-shell-in-linux-for-beginners/
"HTML, CSS, React - Certification Course for Beginners",https://www.udemy.com/course/html-css-react-certification-course-for-beginners/
Python Programming: Create an Digital Marketplace in Django,https://www.udemy.com/course/coding-for-entrepreneurs-marketplace-daily-deals/
Artificial Intelligence (AI) in Software Testing,https://www.udemy.com/course/artificial-intelligence-ai-in-software-testing/
Practical Python Programming Practices (100 Common Projects),https://www.udemy.com/course/100-python-programming-best-practices-for-absolute-beginner/
Become a Front End Web Developer - JavaScript for Beginners,https://www.udemy.com/course/start-js/
WordPress REST API Complete Beginners Guide,https://www.udemy.com/course/wordpress-rest-api-course/
Learn Plugin Development in WordPress By Building Projects,https://www.udemy.com/course/learn-plugin-development-in-wordpress-by-building-projects/
Flutter & Firebase Tutorial: Build 5 Social Media Apps,https://www.udemy.com/course/flutter-firebase-tutorial-build-5-social-media-apps/
"2023 SDLC Full Stack Course Spring Boot 3, MongoDB, Docker",https://www.udemy.com/course/sdlc-with-soa-spring-jms-git-activemq-mongodb-jenkins/
Try Udemy Business,https://www.udemy.com/udemy-business/request-demo-mx/?ref=right-rail&locale=en_US
"Master Redis - From Beginner to Advanced, 20+ hours",https://www.udemy.com/course/masterredis/
The Complete Guide to Bot Creation,https://www.udemy.com/course/the-complete-guide-to-bot-creation/
Salesforce Development for Intermediate Developers,https://www.udemy.com/course/salesforce-development-course/
The Complete Spark AR Course: Build 10 Instagram AR Effects,https://www.udemy.com/course/the-complete-spark-ar-course/
Getting Started with Java,https://www.udemy.com/course/java-development-environment/
Learn React & Angular Step by Step: Building Projects (2023),https://www.udemy.com/course/react-angular-complete-guide-for-beginners-step-by-step/
"Creating turn-based game, Unity Engine",https://www.udemy.com/course/turn-based-strategy-game-development/
Android Firebase Masterclass - Master Google Firebase,https://www.udemy.com/course/android-firebase-masterclass/
Learn Complete Python-3 GUI using Tkinter,https://www.udemy.com/course/learn-complete-python-3-gui-using-tkinter/
"Power BI Masterclass 8 - Python, Finance, and advanced DAX",https://www.udemy.com/course/power-bi-masterclass-8-python-finance-and-advanced-dax/
"Learn JIRA Quickly - Enhance your resume, Move Ahead!",https://www.udemy.com/course/learn-jira-quickly/
Node.js Tutorial For Absolute Beginners,https://www.udemy.com/course/learn-node-js-complete-from-very-basics-to-advance/
Object Oriented PHP & TDD with PHPUnit from Scratch,https://www.udemy.com/course/object-oriented-php-tdd-with-phpunit-from-scratch/
Design Like a Pro with WordPress and Elementor!,https://www.udemy.com/course/how-to-create-a-website-with-wordpress-2022-fast/
Complete iOS 16 Developer with swift UI and 10 apps,https://www.udemy.com/course/complete-ios-developer-swiftui/
SQL for Beginners with Microsoft SQL Server Database,https://www.udemy.com/course/sql-with-microsoft-sql-server/
Try Udemy Business,https://www.udemy.com/udemy-business/request-demo-mx/?ref=right-rail&locale=en_US
Create Dynamic Forms HTML CSS JavaScript and jQueryUI,https://www.udemy.com/course/create-dynamic-web-forms-with-jquery/
NodeJS - The Complete Web Developer Bootcamp 2023,https://www.udemy.com/course/nodejs-complete-guide-to-building-data-driven-applications/
C# Introduction,https://www.udemy.com/course/cwc-introduction/
SQL Server Master Data Services for Master Data Management,https://www.udemy.com/course/sql-server-master-data-services-master-data-management/
100 Algorithms Challenge,https://www.udemy.com/course/100-algorithms-challenge/
The Comple JavaScript From Beginner To Advanced,https://www.udemy.com/course/the-comple-javascript-from-beginner-to-advanced/
Learn Programming - An Introduction For Non-Programmers,https://www.udemy.com/course/learn-programming-an-introduction-for-non-programmers/
iOS 13 & Swift 5: Chat App With Firestore | MVVM,https://www.udemy.com/course/ios-13-swift-5-chat-app-with-firestore-mvvm/
Introduction to Node-RED,https://www.udemy.com/course/introduction-to-node-red/
CSS3 Basics,https://www.udemy.com/course/learn-basic-css3/
Programming with Python,https://www.udemy.com/course/programming-with-python/
Game Audio 101: How to Create Sounds for Games,https://www.udemy.com/course/gameaudio101/
Java Interview Questions Boot Camp - 1000+ Q& A Master Class,https://www.udemy.com/course/java-interview-questions-bootcamp-master-class-1000-java-questions/
Refactoring Java with IntelliJ IDEA,https://www.udemy.com/course/refactoring-java-with-intellij-idea/
Learn Java Programming - Beginners guide 2023,https://www.udemy.com/course/learn-java-programming-from-beginner-to-pro-2020/
Python - Solve 250 Python Quizzes,https://www.udemy.com/course/python-quiz/
Try Udemy Business,https://www.udemy.com/udemy-business/request-demo-mx/?ref=right-rail&locale=en_US
neural networks for sentiment and stock price prediction,https://www.udemy.com/course/neural-networks-for-stock-price-prediction-and-sentiment/
"DevSecOps & DevOps with Jenkins, Kubernetes, Terraform & AWS",https://www.udemy.com/course/devsecops-with-terraform-kubernetes-jenkins-aws/
The Beginners Guide to 3D Web Game Development with ThreeJS,https://www.udemy.com/course/beginners-3d-web-game-development-with-threejs/
Python and Flask Full-Stack Web Development for beginners,https://www.udemy.com/course/python-and-flask-full-stack-web-development-for-beginners/
"Rocking DevOps with Jenkins, Kubernetes, Ansible",https://www.udemy.com/course/rocking-devops-with-jenkins-kubernetes-ansible/
The Ultimate Swagger Tools Course: Build OpenAPI with Ease,https://www.udemy.com/course/swagger-tools-openapi/
Mastering ASP.NET Core MVC 3.1 & 5.0 From Scratch Using C#,https://www.udemy.com/course/mastering-aspnetcoremvc/
Let's Get Interactive with Storyline 3 / 360,https://www.udemy.com/course/lets-get-interactive-with-storyline-3-360/
Learn MongoDB 3 and Rapidly Develop Scalable Applications,https://www.udemy.com/course/mongodb-tutorial/
Practical Google BigQuery for those who already know SQL,https://www.udemy.com/course/practical-google-bigquery-for-those-who-already-know-sql/
Learn DevOps: Scaling apps On-Premises and in the Cloud,https://www.udemy.com/course/learn-devops-scaling-apps-on-premise-and-in-the-cloud/
Dart & Flutter - Zero to Mastery [2023] + Clean Architecture,https://www.udemy.com/course/flutter-made-easy-zero-to-mastery/
"HP UFT Online Training, HP QTP Online Course, free videos",https://www.udemy.com/course/automation-testing-hp-uft-unified-functional-testing-qtp/
Next.JS with Sanity CMS - Serverless Blog App (w/ Vercel),https://www.udemy.com/course/nextjs-with-sanity-cms-serverless-blog-app-w-vercel/
RASA :Build and Deploy Chatbot On The Cloud (100% FREE),https://www.udemy.com/course/create-artificial-intelligent-chatbot-with-rasa-in-one-hour/
Oracle Apex - Web App Development,https://www.udemy.com/course/oracle-apex-web-app-development/
Try Udemy Business,https://www.udemy.com/udemy-business/request-demo-mx/?ref=right-rail&locale=en_US
The Complete MySQL Bootcamp: Become an Expert in SQL & MySQL,https://www.udemy.com/course/complete-mysql-bootcamp/
FastAPI Full Stack Web Development (API + Webapp),https://www.udemy.com/course/fastapi-course/
Freemium Principles: Design F2P Games that Generate Revenue,https://www.udemy.com/course/freemium-business-model/
Introduction to Testing in Go (Golang),https://www.udemy.com/course/introduction-to-testing-in-go-golang/
I want to connect my Xamarin Forms app to REST API,https://www.udemy.com/course/i-want-to-connect-my-xamarin-forms-app-to-rest-api/
Python for Beginners: Learn Python with Practical Exercises!,https://www.udemy.com/course/the-ultimate-python-programming-course-d/
DevOps For Beginners: Saving Your Code From The Apocalypse,https://www.udemy.com/course/devops-saving-your-code-from-the-apocalypse/
Web Hosting Introduction: How to Publish Your Website Online,https://www.udemy.com/course/web-hosting-introduction/
Web Development Boot Camp 2021,https://www.udemy.com/course/creating-5-web-development-projects-in-html5-and-css3/
Comprehensive Python Programming Course with Hands-on Coding,https://www.udemy.com/course/python-programming-training-for-beginners/
Become a Node.js developer:/Node.js/Express.js/MongoDB/API,https://www.udemy.com/course/become-a-nodejs-developernodejsexpressjsmongodbapi/
Java Training Complete Course 2022,https://www.udemy.com/course/java-training-complete-course-2022/
Adobe Muse CC Course - Design and Launch Websites,https://www.udemy.com/course/website-design-adobe-muse-course/
Optimizing web performance and critical rendering path,https://www.udemy.com/course/optimizing-web-performance-and-critical-rendering-path/
JavaFX tutorial: Learn JavaFX with Examples,https://www.udemy.com/course/javafx-tutorial-beginners/
Learn Basic to Advance JIRA for Testers/QA/Test Manager-2023,https://www.udemy.com/course/jirawithagile/
Try Udemy Business,https://www.udemy.com/udemy-business/request-demo-mx/?ref=right-rail&locale=en_US
Practical Introduction to Machine Learning with Python,https://www.udemy.com/course/practical-machine-learning/
Full WordPress Website For Beginners: Learn WordPress A-Z,https://www.udemy.com/course/wordpress-website-beginners-tutorial-course-best-elementor-learn/
Learn to Create & Publish Games for Mobile,https://www.udemy.com/course/unitymobile/
Git and GitHub from scratch,https://www.udemy.com/course/git-and-github-from-scratch/
Cluster Analysis- Theory & workout using SAS and R,https://www.udemy.com/course/cluster-analysis-motivation-theory-practical-application/
Beginner's Guide to Python Data Analysis & Visualization,https://www.udemy.com/course/complete-pandas-bootcamp-with-python-3/
Mapping in Leaflet JS,https://www.udemy.com/course/mapping-in-leafletjs/
three.js and webgl 3D programming master class 2021,https://www.udemy.com/course/threejs-and-webgl-3d-programming-master-class-2021/
React JS Notes App & Crash Course,https://www.udemy.com/course/react-crash-course/
Computer Vision: YOLO Custom Object Detection with Colab GPU,https://www.udemy.com/course/computer-vision-yolo-custom-object-detection-with-colab-gpu/
Learn Python and Django: Payment Processing,https://www.udemy.com/course/learn-django-code-accept-payments-with-stripe/
CSS Flexbox in Depth,https://www.udemy.com/course/flexbox-in-depth/
Oracle APEX Advanced Course - Learn JavaScript (2023),https://www.udemy.com/course/oracle-apex-advanced-course/
"*UPDATED* Web Development Secrets 2023 - CRP, HTTP, AJAX ETC",https://www.udemy.com/course/new-web-development-secrets/
Product Management for Maximum Impact,https://www.udemy.com/course/product-strategy-growth/
Cypress with Cucumber BDD - Beginner to Expert in 9 Hours!,https://www.udemy.com/course/cypress-with-cucumber-bdd-beginner-to-expert-in-9-hours/
Try Udemy Business,https://www.udemy.com/udemy-business/request-demo-mx/?ref=right-rail&locale=en_US
"Start with TALL: Use Tailwind, Alpine, Laravel & Livewire",https://www.udemy.com/course/tall-stack-integrate-tailwind-alpine-laravel-and-livewire/
Python and Tableau: The Complete Data Analytics Bootcamp!,https://www.udemy.com/course/python-and-tableau-the-complete-data-analytics-bootcamp/
"Git, GitHub & Markdown Crash Course: Learn Git, GitHub & MD",https://www.udemy.com/course/git-github-markdown-crash-course-learn-git-github-md/
Python Playground for Kids & Absolute Beginners,https://www.udemy.com/course/python-crash-course-for-kids-beginners-programming-coding/
Create a PHP Login and Registration System From Scratch 2020,https://www.udemy.com/course/create-php-ajax-js-jquery-mysql-login-system-today/
Laravel Database Queries - From Beginner to Super Advanced,https://www.udemy.com/course/laravel-database-queries-from-beginner-to-super-advanced/
Full Stack Web & Mobile App Development | Mern Stack Project,https://www.udemy.com/course/full-stack-web-mobile-app-development-mern-stack-project/
Learn Mobile App Development with .NET MAUI,https://www.udemy.com/course/learn-net-maui/
Python Programming/Script/OOP/Advanced for Python Projects,https://www.udemy.com/course/python-programming-in-depth/
Loopback 4: Modern ways to Build APIs in Typescript & NodeJs,https://www.udemy.com/course/loopback-4-the-complete-developers-guide/
Data Science for Professionals,https://www.udemy.com/course/data-science-for-professionals/
AWS Lambda For The .NET Developer,https://www.udemy.com/course/aws-lambda-dotnet/
From Sketch Design to iOS App with Swift and Xcode,https://www.udemy.com/course/from-design-to-code/
"Installing Wordpress - Installation, Registrars & Hosting",https://www.udemy.com/course/installing-wordpress-domain-registrars-and-web-hosting/
Server Infrastructure Basics,https://www.udemy.com/course/server-infrastructure/
Unity2D Professional Development From A to Z Build 10 Games,https://www.udemy.com/course/unity3d-professional-2d-game-development-from-a-to-z/
Try Udemy Business,https://www.udemy.com/udemy-business/request-demo-mx/?ref=right-rail&locale=en_US
