Course Name,URL
Fundamentals of Electrical Instrumentation,https://www.udemy.com/course/fundamentals-of-electrical-instrumentation/
Apache Spark Hands on Specialization for Big Data Analytics,https://www.udemy.com/course/apache-spark-hands-on-course-big-data-analytics/
The Divi WordPress Theme for Beginners,https://www.udemy.com/course/divi-wordpress-theme-for-beginners/
Master Data Management,https://www.udemy.com/course/master-data-management/
R Programming Hands-on Specialization for Data Science (Lv1),https://www.udemy.com/course/r-programming-data-science-hands-on-course/
Full Scratch 3.0 Programming Course: Beginner to Advanced,https://www.udemy.com/course/learn-to-code-with-scratch-programming-course/
Python Programming for Begineers,https://www.udemy.com/course/python-for-machine-learning-t/
Beginner's Guide to Multiplayer Game Development in Unity,https://www.udemy.com/course/beginners-guide-to-multiplayer-game-development-in-unity/
The Beginners Guide To Learning HTML/HTML5 the right way.,https://www.udemy.com/course/takethefirststep/
JavaScript Basics,https://www.udemy.com/course/learn-basic-javascript/
Learn Web Animation the Easy Way: An Intro to SVG and GSAP,https://www.udemy.com/course/learn-web-animation-with-svg-and-gsap/
Modern web development course: beginner to advanced,https://www.udemy.com/course/mordern-web-development-course-beginner-to-advanced/
Modern web development course: beginner to advanced,https://www.udemy.com/course/mordern-web-development-course-beginner-to-advanced/
Java for Testers,https://www.udemy.com/course/java-for-testers-dmitry/
The Perfect Nginx Server - Ubuntu Edition,https://www.udemy.com/course/the-perfect-nginx-server-ubuntu-edition/
Try Udemy Business,https://www.udemy.com/udemy-business/request-demo-mx/?ref=right-rail&locale=en_US
Machine Learning No-Code Approach: Using Azure ML Studio,https://www.udemy.com/course/machine-learning-no-code-approach-using-azure-ml-studio/
Talend + SQL + Datawarehousing - Beginner to Professional,https://www.udemy.com/course/talendsql/
Level Management in Unity,https://www.udemy.com/course/level-management-in-unity/
Appium and Selenium with Python From Basics to Framework.,https://www.udemy.com/course/appium-and-selenium-with-python/
Regression Analysis for Statistics & Machine Learning in R,https://www.udemy.com/course/regression-analysis-for-statistics-machine-learning-in-r/
"Chart JS, the complete guide. ChartJS missing manual.",https://www.udemy.com/course/chart-js/
DOCKER | Step by Step for Beginners | with Sample Project,https://www.udemy.com/course/what-is-docker-step-by-step-for-beginners/
Ready for Production with Spring Boot Actuator,https://www.udemy.com/course/ready-for-production-with-spring-boot-actuator/
Selenium WebDriver: Automation Testing with Python,https://www.udemy.com/course/selenium-webdriver-python-course/
Data Science and Machine Learning For Beginners with Python,https://www.udemy.com/course/data-science-and-machine-learning-for-beginners-with-python-c/
Learn By Example : Apache Storm,https://www.udemy.com/course/learn-by-example-apache-storm/
Complete MySQL Database Administration Course,https://www.udemy.com/course/complete-mysql-training-for-data-analysis-on-linux/
Cucumber BDD Masterclass with Selenium 4 & Java + Framework,https://www.udemy.com/course/cucumber-bdd-masterclass/
Agile Retrospective+Continuous Improvement+Kaizen wth Scrum,https://www.udemy.com/course/agile-retrospectives-kaizen-lean/
The Git and GitHub for Beginners,https://www.udemy.com/course/git-github-crash-course/
Full JavaScript Masterclass Course: ES6 Modern Development,https://www.udemy.com/course/javascript-series/
Try Udemy Business,https://www.udemy.com/udemy-business/request-demo-mx/?ref=right-rail&locale=en_US
Blockchain Programming,https://www.udemy.com/course/build-your-own-cryptocurrency-in-48-hours/
C# Programming for Beginners : The First Steps,https://www.udemy.com/course/c-programming-a-practical-applications-approach/
Laravel 9 -Build Complete Multi Vendor Ecommerce Project A-Z,https://www.udemy.com/course/laravel-multi-vendor-ecommerce-project/
JavaScript Console Object Ultimate Guide,https://www.udemy.com/course/javascript-console-object-ultimate-guide/
"Ruby on Rails 5 - BDD, RSpec and Capybara",https://www.udemy.com/course/ruby-rails-5-bdd-rspec-capybara/
React + Redux - The beginner guide. (2023 edition),https://www.udemy.com/course/react-js-redux-the-beginner-guide-2023-edition/
Azure Active Directory for .NET Developers (AD and B2C),https://www.udemy.com/course/azure-active-directory-for-net-developers-ad-and-b2c/
Learning Data Structures and Algorithms,https://www.udemy.com/course/learning-data-structures-and-algorithms/
Multithreading and Parallel Programming in C#,https://www.udemy.com/course/parallel-csharp/
"C, C++, Python and Ruby Programming",https://www.udemy.com/course/c-c-python-ruby-java-html5-php-programming-for-beginners/
JIRA Test Management using ZEPHYR for TESTERS,https://www.udemy.com/course/jira-test-management-using-zephyr-for-testers/
How To Launch Your App In Just 16 hrs - Android Development,https://www.udemy.com/course/design-code-an-android-app-from-scratch/
C and C++ Programming : Step-by-Step Tutorial,https://www.udemy.com/course/c-and-c-programming/
Salesforce Flows - Learn Salesforce Lightning Flows Fast,https://www.udemy.com/course/salesforce-flows/
Learn Flowcharting. Be a Professional programmer!,https://www.udemy.com/course/flowcharting-flowchart-learn-flowcharting-be-a-professional-programmer/
The Advanced Xamarin Developer Masterclass,https://www.udemy.com/course/the-advanced-xamarin-developer-masterclass/
Try Udemy Business,https://www.udemy.com/udemy-business/request-demo-mx/?ref=right-rail&locale=en_US
Modern Multi Vendors E-Commerce Store In PHP,https://www.udemy.com/course/modern-e-commerce-store-in-php-mysqli-with-bootstrap/
"Data Lake, Firehose, Glue, Athena, S3 and AWS SDK for .NET",https://www.udemy.com/course/data-lake-firehose-glue-athena-s3-and-aws-sdk-for-net/
iOS 12 Swift 4.2 - The Complete iOS App Development Bootcamp,https://www.udemy.com/course/ios-12-app-development-bootcamp/
Algorithms and Data Structures in Swift 5,https://www.udemy.com/course/introduction-to-algorithms-in-swift/
Python Programming for Beginners - Practical & In Real-Time,https://www.udemy.com/course/learn-complete-python-3-for-beginners/
Spice Up Your C# Code With Advanced Language Features,https://www.udemy.com/course/spice-up-your-csharp-code-with-advanced-language-features/
BDD in C# - using Specflow (Cucumber) to develop a REST API and automate software testing,https://www.udemy.com/course/bdd-in-c-using-specflow-cucumber-to-develop-a-rest-api/
Learn C programming from Scratch,https://www.udemy.com/course/learn-c-programming-from-scratch/
"Regression, Data Mining, Text Mining, Forecasting using R",https://www.udemy.com/course/data-science-using-r/
Beginner's guide to Competitive programming using python,https://www.udemy.com/course/competitive-programming-using-python/
Xamarin Android: Learn to Build Native Android Apps With C#,https://www.udemy.com/course/xamarin-android-app-with-cshap/
2023 Complete SQL Bootcamp from Zero to Hero in SQL,https://www.udemy.com/course/2022-complete-sql-bootcamp-from-zero-to-hero-in-sql/
HTML5 & CSS3 for Beginners | The Ultimate Guide,https://www.udemy.com/course/html5-and-css3-step-by-step-from-the-complete-scratch/
"CMake, Tests and Tooling for C/C++ Projects [2022 Edition]",https://www.udemy.com/course/cmake-tests-and-tooling-for-cc-projects/
PostgreSQL Database Administration on Windows/Linux- Part 2,https://www.udemy.com/course/postgresql-v12-database-administration-on-winlinux-part-2/
The Complete ASP.Net Web Forms with ADO.Net From Scratch,https://www.udemy.com/course/aspnet-and-adonet-from-scratch/
Try Udemy Business,https://www.udemy.com/udemy-business/request-demo-mx/?ref=right-rail&locale=en_US
17 Beginner C# Walkthrough Projects step by step,https://www.udemy.com/course/17-beginner-c-walkthrough-projects-step-by-step/
Solidity Smart Contracts: Build DApps In Ethereum Blockchain,https://www.udemy.com/course/solidity-smart-contracts-build-dapps-in-ethereum-blockchain/
Data Structures and Algorithms: In Depth using C#,https://www.udemy.com/course/data-structures-and-algorithms-in-depth-using-c-sharp/
Complete python programming for beginners,https://www.udemy.com/course/complete-python-programming-for-beginners/
Learn to Program with C++,https://www.udemy.com/course/learn-c/
"Modern Android app using Java, MVVM, Dagger2, RxJava &more",https://www.udemy.com/course/modernandroidappjava/
Excel Tips and trick : Learn MS Excel by making 7 Projects,https://www.udemy.com/course/excel-tips-and-trick-learn-ms-excel-by-making-7-projects/
JavaScript Programming from A-Z: Learn to Code in JavaScript,https://www.udemy.com/course/complete-javascript/
Git for Windows: Step-By-Step Mastery using Commands and GUI,https://www.udemy.com/course/git-for-windows/
Learn C++ Programming by Making Games,https://www.udemy.com/course/learn-programming-by-making-games/
Learning JavaScript Programming Tutorial. A Definitive Guide,https://www.udemy.com/course/programming-javascript/
Bootstrap Basics: Program Responsive Websites,https://www.udemy.com/course/code-responsive-website-twitter-bootstrap/
"CSS, Bootstrap ,JavaScript, Web Development Course",https://www.udemy.com/course/css-bootstrap-javascript-web-development-course/
Let's Learn Laravel: A Guided Path For Beginners,https://www.udemy.com/course/lets-learn-laravel-a-guided-path-for-beginners/
Unreal Engine 4: For Absolute Beginners,https://www.udemy.com/course/unreal-engine-4-ue4/
Google Assistant development with Actions on Google,https://www.udemy.com/course/actions-on-google-app-google-assistant/
Try Udemy Business,https://www.udemy.com/udemy-business/request-demo-mx/?ref=right-rail&locale=en_US
Whatsapp Automation Using Python,https://www.udemy.com/course/whatsapp-automation/
Node.js - The Complete RESTful API Masterclass (2023),https://www.udemy.com/course/build-restful-api-in-nodejs/
Automated Test Framework : ServiceNow,https://www.udemy.com/course/automated-test-framework-servicenow/
Data Science Masterclass With R 8 Case Studies + 4 Projects,https://www.udemy.com/course/data-science-complete-course/
The Complete Python Course for Machine Learning Engineers,https://www.udemy.com/course/the-complete-python-course-for-machine-learning-engineers/
Angular and Node.js Integration,https://www.udemy.com/course/angular-and-nodejs-integration/
Artificial Neural Networks for Business Managers in R Studio,https://www.udemy.com/course/neural-network-understanding-and-building-an-ann-in-r/
Getting Started with Spring Boot 2,https://www.udemy.com/course/spring-boot-2/
jQuery Ultimate Guide,https://www.udemy.com/course/the-learn-jquery-course/
Build a Idle Clicker Business Sim: Unity C# Game Development,https://www.udemy.com/course/build-a-tycoon-business-sim-in-unity3d-c-game-development/
The Complete SQL Server For Beginners,https://www.udemy.com/course/the-complete-sql-server-for-developers/
Advanced Topics in C#,https://www.udemy.com/course/advanced-topics-csharp/
Batch Script Programming Crash Course (CMD),https://www.udemy.com/course/batch-script-programming/
Swift Essentials - Learn Swift 2.1 Step by Step,https://www.udemy.com/course/swift-learn-apples-new-programming-language-by-examples/
QlikView Server and Publisher,https://www.udemy.com/course/qlikview-server-and-publisher/
Mastering ASP.NET 4 from scratch Using C# - Part 1,https://www.udemy.com/course/masteraspnet/
Try Udemy Business,https://www.udemy.com/udemy-business/request-demo-mx/?ref=right-rail&locale=en_US
Complete HTML Tutorial from scratch,https://www.udemy.com/course/html-complete-html-course-for-beginners/
Master NestJS 9 - Node.js Framework 2023,https://www.udemy.com/course/master-nestjs-the-javascript-nodejs-framework/
The Complete WordPress Website Business Course 2.0,https://www.udemy.com/course/the-complete-wordpress-website-business-course-20/
Introduction to Kotlin for Java Developers,https://www.udemy.com/course/kotlin-java/
Machine Learning A-Z: Become Kaggle Master,https://www.udemy.com/course/machine-learning-become-kaggle-master/
Professional Azure SQL Database Administration,https://www.udemy.com/course/professional-azure-sql-database-administration/
Angular automation with Protractor + Typescript + Cucumber,https://www.udemy.com/course/protractor/
Laravel : Make six projects with PHP and Laravel,https://www.udemy.com/course/laravel-masterclass-build-web-apps-with-laravel-7-php/
Programming For Non-Programmers: Fundamentals,https://www.udemy.com/course/programming-for-non-programmers/
Become a Python Data Analyst,https://www.udemy.com/course/become-a-python-data-analyst/
Species Distribution Models with GIS & Machine Learning in R,https://www.udemy.com/course/species-distribution-models-with-gis-machine-learning-in-r/
SQL and Data Visualization - The Complete Bootcamp,https://www.udemy.com/course/sql-data-visualization-the-complete-course/
How to Make a 2D Platformer with Unity & C#,https://www.udemy.com/course/how-to-make-a-2d-platformer-with-unity-c/
Python GUI Development with PyQt6 & Qt Designer,https://www.udemy.com/course/python-gui-development-with-pyqt6/
Go Programming (Golang): The Complete Developer's Guide,https://www.udemy.com/course/go-programming-golang-the-complete-developers-guide/
Master JavaScript from Scratch (with jQuery and React JS),https://www.udemy.com/course/javascript-jquery-react/
Try Udemy Business,https://www.udemy.com/udemy-business/request-demo-mx/?ref=right-rail&locale=en_US
The Kotlin Language: Fundamentals and Basics,https://www.udemy.com/course/kotlin-programming/
Data Structures and Algorithms Python: The Complete Bootcamp,https://www.udemy.com/course/data-structures-and-algorithms-masterclass/
The Most Comprehensive Web Development Course,https://www.udemy.com/course/comprehensive-web-developer-course/
Basics of GraphQL with Ruby on Rails,https://www.udemy.com/course/basics-of-graphql-with-ruby-on-rails/
Practical AutoLISP Programming - Beginner to Advanced,https://www.udemy.com/course/practical-autolisp-programming-beginner-to-advanced/
The Art of Doing: Video Game Creation With Python and Pygame,https://www.udemy.com/course/the-art-of-doing-video-game-creation-with-python-and-pygame/
Python Scripting in Blender 3x with Practical Projects,https://www.udemy.com/course/python-scripting-in-blender-with-practical-projects/
Procedural Race Tracks - Houdini 17.5/18 and Houdini Engine,https://www.udemy.com/course/procedural-race-tracks-houdini-175-and-houdini-engine/
From A Non Programmer To Full Stack .NET Developer,https://www.udemy.com/course/from-a-non-programmer-to-full-stack-net-developer/
Learn to Build Interactive Modern Web Apps with Angular 13+,https://www.udemy.com/course/complete-angular-9-course-for-beginners/
Laravel 7 for Beginners practical course,https://www.udemy.com/course/laravel-7-for-beginners-practical-course/
SQL Made Simple: SQL Server Queries for Non-Programmers,https://www.udemy.com/course/learn-sql/
PLC & AC Drive with Automatic & Manual Industrial Control,https://www.udemy.com/course/plc-ac-drive-with-automatic-manual-industrial-control/
Build a User Authentication Web App With Python and Django,https://www.udemy.com/course/build-a-user-authentication-web-app-with-python-and-django/
Selenium in Java - Setup Simple Test Automation Framework,https://www.udemy.com/course/selenium-in-java-taf-for-beginners-learnit/
Getting Started with LESS - Beginner Crash Course,https://www.udemy.com/course/getting-started-with-less-beginner-crash-course/
Try Udemy Business,https://www.udemy.com/udemy-business/request-demo-mx/?ref=right-rail&locale=en_US
Complete Python Programming 2020: Beginner to Advanced,https://www.udemy.com/course/python-programming-masterclass-beginner-to-professional/
Scala Programming In-Depth,https://www.udemy.com/course/scala-programming/
"Vue JS 3: The Composition API (Inc Script Setup, TypeScript)",https://www.udemy.com/course/vuejs-3-the-composition-api/
JavaScript and React for Developers: Master the Essentials,https://www.udemy.com/course/js-and-react-for-devs/
The Complete Android Oreo Tutorial - Make 30 Apps,https://www.udemy.com/course/the-complete-android-tutorial-for-beginners/
Learn Java Creating Android Games Using the LibGDX library,https://www.udemy.com/course/libgdx-game-development-masterclass/
The Complete Guide to JSON Parsing Using Swift 5,https://www.udemy.com/course/ultimate-guide-to-json-parsing-with-swift/
Unreal Engine Cinematic Creator for Video Game Design,https://www.udemy.com/course/unreal-cinematics/
The Complete Java Programmer: From Scratch to Advanced,https://www.udemy.com/course/the-complete-java-programmer-from-scratch-to-advanced/
Digital Signal Processing (DSP) From Ground Up™ with MATLAB,https://www.udemy.com/course/matlab_dsp/
Financial Analysis: Build a ChatGPT Pairs Trading Bot,https://www.udemy.com/course/chatgpt-pairs-trading/
Master the MEAN Stack - Learn By Example,https://www.udemy.com/course/master-the-mean-stack/
Java/Apache Maven: The Truth About Building Java Programs,https://www.udemy.com/course/apachemaven2/
Webservices API Testing with Postman - Complete Guide,https://www.udemy.com/course/api-testing-with-postman-for-beginners-learnit/
JavaScript programming: JavaScript for beginners,https://www.udemy.com/course/learn-javascript-online/
PHP with PDO - ULTIMATE Crash Course,https://www.udemy.com/course/php-with-pdo-ultimate-crash-course/
Try Udemy Business,https://www.udemy.com/udemy-business/request-demo-mx/?ref=right-rail&locale=en_US
C++ Development Tutorial Series - The Complete Coding Guide,https://www.udemy.com/course/cpp-course/
Introduction to D3.js with React,https://www.udemy.com/course/d3-react/
"Text Mining, Scraping and Sentiment Analysis with R",https://www.udemy.com/course/r-social-media-mining-scraping-with-twitter/
Rust: Building Reusable Code with Rust from Scratch,https://www.udemy.com/course/rust-building-reusable-code-with-rust-from-scratch/
Tailwind CSS - A new way to > THINK < CSS,https://www.udemy.com/course/tailwindcss-with-examples/
"Master Full-Stack Web Development | Node, SQL, React, & More",https://www.udemy.com/course/full-stack/
Web Development Concepts for Everyone,https://www.udemy.com/course/web-development-concepts-for-everyone/
Wordpress Complete Website MasterClass - Wordpress Made Easy,https://www.udemy.com/course/wordpress-complete-website-masterclass-wordpress-made-easy/
VPC Solutions with EC2 for Production: AWS with Terraform,https://www.udemy.com/course/vpc-solutions-with-ec2-for-production-aws-with-terraform/
Learn Python: The Complete Python Automation Course!,https://www.udemy.com/course/pythonautomation/
Advanced Ruby Programming: 10 Steps to Mastery,https://www.udemy.com/course/expert-ruby-programming-ten-steps-to-mastery/
Support Vector Machines in Python: SVM Concepts & Code,https://www.udemy.com/course/machine-learning-adv-support-vector-machines-svm-python/
Augmented Reality in Depth 101,https://www.udemy.com/course/augmented-reality-in-depth-101-by-debayandey-thnewagetraveller/
Augmented Reality in Depth 101,https://www.udemy.com/course/augmented-reality-in-depth-101-by-debayandey-thnewagetraveller/
Git Masterclass,https://www.udemy.com/course/git-masterclass/
WordPress Development For Beginners,https://www.udemy.com/course/wordpress-basic/
Try Udemy Business,https://www.udemy.com/udemy-business/request-demo-mx/?ref=right-rail&locale=en_US
The Complete Web Development Bootcamp,https://www.udemy.com/course/full-stack-web-development-bootcamp/
ChatGPT For Beginners: Smart Tips For ChatGPT Prompts,https://www.udemy.com/course/chatgpt-smart-tips/
Drupal For Absolute Beginners (2023),https://www.udemy.com/course/drupal-masterclass/
Intro To SQLite Databases for Python Programming,https://www.udemy.com/course/using-sqlite3-databases-with-python/
Setup a Virtual Web Server using Linode or Digital Ocean,https://www.udemy.com/course/setup-a-virtual-web-server-using-linode-or-digital-ocean/
Make a Multiplayer Shooter in Unity,https://www.udemy.com/course/make-a-multiplayer-shooter-in-unity/
RabbitMQ & Java (Spring Boot) for System Integration,https://www.udemy.com/course/rabbitmq-java-spring-boot-for-system-integration/
Natural Language Processing (NLP) in Python with 8 Projects,https://www.udemy.com/course/complete-natural-language-processing-nlp-with-spacy-nltk/
Data Science with Python Complete Course,https://www.udemy.com/course/data-science-with-python-complete-course/
Top Python and Javascript Programming Bundle,https://www.udemy.com/course/python-and-javascript-programming-bundle/
Studio 5000 PLC Ladder Logic Training. Advanced,https://www.udemy.com/course/advanced-plc-ladder-programming-using-logix5000/
C# Basics for Beginners: Learn Coding with C#,https://www.udemy.com/course/c-sharp-basics/
Applied Text Mining and Sentiment Analysis with Python,https://www.udemy.com/course/applied-text-mining-and-sentiment-analysis-with-python/
Intro to React Native build a cryptocurrency tracker app,https://www.udemy.com/course/ultimate-react-native-with-firebase/
ZERO to GOD Python 3.8 FULL STACK MASTERCLASS 45 AI projects,https://www.udemy.com/course/zero-to-pro-python-3-fullstack-data-bootcamp-45-ai-projects/
Unity 3D Video Game Kit Introduction,https://www.udemy.com/course/gamekit3d/
Try Udemy Business,https://www.udemy.com/udemy-business/request-demo-mx/?ref=right-rail&locale=en_US
Develop Full iOS Twitter Clone App in Swift & Custom Backend,https://www.udemy.com/course/swift-php-mysql-html/
Artificial Intelligence II - Hands-On Neural Networks (Java),https://www.udemy.com/course/neural-networks-from-scratch-in-java/
SQL - The Query Writing Bootcamp [2019],https://www.udemy.com/course/sql-the-query-writing-bootcamp/
Ionic Basics,https://www.udemy.com/course/ionic-basics/
Introduction to Docker,https://www.udemy.com/course/introduction-to-docker/
React native Expo for multiplatform mobile app development,https://www.udemy.com/course/react-native-expo-for-multiplatform-ios-android-mobile-app-development/
Python for Beginners,https://www.udemy.com/course/python-for-beginners-/
How to Make a Freaking iPhone App - iOS 11 and Swift 4,https://www.udemy.com/course/how-to-make-a-freaking-iphone-app-ios-11-and-swift-4-xcode-9/
Big Data and Hadoop for Absolute Beginners,https://www.udemy.com/course/learn-hadoop-step-by-step-from-scratch/
Instagram Firestore App Clone | Swift 5 + iOS 14 | MVVM,https://www.udemy.com/course/instagram-firestore-app-clone-swift-5-ios-14-mvvm/
Python Programming for Beginners with Hands on Tutorial,https://www.udemy.com/course/python-programming-for-beginners-interviews/
Bluebeam in 3 Hours,https://www.udemy.com/course/bluebeam-in-3-hours/
LEARNING PATH: Azure: Explore Azure Functions and Logic Apps,https://www.udemy.com/course/learning-path-azure-explore-azure-functions-and-logic-apps/
PowerApps for Beginners,https://www.udemy.com/course/powerapps-for-beginners/
Learn C# and make a videogame with Unity,https://www.udemy.com/course/learn-program-csharp-make-videogame-unity-prefabs-animations-platform/
The Absolute Beginner's Guide To Unreal Engine 4 and 5!,https://www.udemy.com/course/the-absolute-beginners-guide-to-learning-unreal-engine-4/
Try Udemy Business,https://www.udemy.com/udemy-business/request-demo-mx/?ref=right-rail&locale=en_US
SQL for Newcomers - The Full Mastery Course,https://www.udemy.com/course/sql-for-newcomers/
Learn MVVM in Xamarin Forms and C#,https://www.udemy.com/course/learn-mvvm-in-xamarin-forms/
C++ Data Structures & Algorithms + LEETCODE Exercises,https://www.udemy.com/course/data-structures-algorithms-cpp/
Mastering Hyperledger Chaincode Development using GoLang,https://www.udemy.com/course/golang-chaincode-development/
"CSS, Bootstrap, JavaScript And PHP Stack Complete Course",https://www.udemy.com/course/css-bootstrap-javascript-and-php-stack-complete-course/
Learn Java Programming | Complete Course,https://www.udemy.com/course/the-complete-java-course-go-from-begginer-to-advanced/
Learn Web Scraping with NodeJs in 2021 - The Crash Course,https://www.udemy.com/course/nodejs-web-scraping/
Complete PHP OOP Concepts for Absolute Beginners + Projects,https://www.udemy.com/course/complete-php-oop-tutorials-for-absolute-beginners-projects/
Computer Vision: Python OCR & Object Detection Quick Starter,https://www.udemy.com/course/computer-vision-python-ocr-object-detection-quick-starter/
Webflow For Beginners: How To Use Webflow,https://www.udemy.com/course/webflow-masterclass-a-tutorial-for-webflow-beginners/
Build an Amazon clone: Nodejs + MongoDB + Stripe Payment,https://www.udemy.com/course/build-an-amazon-clone-nodejs-stripe-elasticsearch/
Top Python and Django Web Development Bundle!,https://www.udemy.com/course/top-python-and-django-web-development-bundle/
Machine Learning - Regression and Classification (math Inc.),https://www.udemy.com/course/machine-learning-regression-and-classification-math-inc/
Javascript Intermediate level 2 - All about functions,https://www.udemy.com/course/javascript-intermediate-mastering-functions/
Learn SQL for Beginners - How To Learn SQL The Easy Way,https://www.udemy.com/course/learn-sql-for-beginners/
Python for ABSOLUTE beginners! *Make 5+ Real-World Projects*,https://www.udemy.com/course/python-for-absolute-beginner/
Try Udemy Business,https://www.udemy.com/udemy-business/request-demo-mx/?ref=right-rail&locale=en_US
C++ MASTERY Course – Build Extraordinary Apps (Step-by-step),https://www.udemy.com/course/the-complete-c-plus-plus-programming-course-build-10-computer-apps/
