Course Name,URL
Scraping and Data Mining for Beginners and Pros,https://www.udemy.com/course/scraping-and-data-mining-for-beginners-and-pros-y/
Learn DevOps: Advanced Kubernetes Usage,https://www.udemy.com/course/learn-devops-advanced-kubernetes-usage/
Try Udemy Business,https://www.udemy.com/udemy-business/request-demo-mx/?ref=right-rail&locale=en_US
The Complete C Programming Course for Beginners,https://www.udemy.com/course/the-complete-c-programming-course-for-beginners/
Master Git and GitHub in 5 Days: Go from Zero to Hero,https://www.udemy.com/course/master-git-and-github-in-5-days-go-from-zero-to-hero/
The Complete SQL Course 2021: Become a MYSQL Master,https://www.udemy.com/course/the-complete-sql-course-2020-become-a-mysql-master/
Studio 5000 PLC Ladder Logic Training. Basic.,https://www.udemy.com/course/basic-introduction-and-programming-of-plcs-using-logix5000/
A Gentle Introduction To ASP.NET For Beginners,https://www.udemy.com/course/a-gentle-introduction-to-aspnet-web-forms-for-beginners/
HTML5 Mastery—Build Superior Websites & Mobile Apps NEW 2023,https://www.udemy.com/course/html5-mastery-mobile-apps-websites/
Understanding NPM - Node.js Package Manager,https://www.udemy.com/course/understanding-npm/
Spring Boot E-Commerce Ultimate Course,https://www.udemy.com/course/spring-boot-e-commerce-ultimate/
A Beginners Guide to Advanced JavaScript & ES6 - ES2017,https://www.udemy.com/course/advanced-javascript-course/
MERN Stack Master Course - Building your own Instagram,https://www.udemy.com/course/mern-stack-master-course-building-your-own-instagram/
Ultimate ASP.NET Core Web API Development Guide,https://www.udemy.com/course/ultimate-aspnet-5-web-api-development-guide/
"SQL Server Analysis Services - SSAS, Data Mining & Analytics",https://www.udemy.com/course/ssas-sql-server-analysis-services-2016-mdx-training/
Learn Basic Commands in Linux Shell,https://www.udemy.com/course/learn-basic-commands-in-linux-shell/
C++ programming step-by-step: From Beginner to Advanced,https://www.udemy.com/course/cplusplus-programming-step-by-step/
Symfony Web Development Complete Guide: Beginner To Advanced,https://www.udemy.com/course/symfony-4-web-development-from-beginner-to-advanced/
CUDA programming Masterclass with C++,https://www.udemy.com/course/cuda-programming-masterclass/
Try Udemy Business,https://www.udemy.com/udemy-business/request-demo-mx/?ref=right-rail&locale=en_US
LangChain- Develop LLM powered applications with LangChain,https://www.udemy.com/course/langchain/
Firebase In Depth,https://www.udemy.com/course/firebase-course/
Neural Networks in Python: Deep Learning for Beginners,https://www.udemy.com/course/neural-network-understanding-and-building-an-ann-in-python/
Python Programming for Beginners,https://www.udemy.com/course/python-and-python-django-for-beginners-2-course-package/
TCP/IP Socket Programming in C# .Net For Coders & Students,https://www.udemy.com/course/tcpip-socket-programming-for-coders-using-csharp-net/
The Ultimate LINQ with C# Masterclass - Basics to Advanced,https://www.udemy.com/course/the-ultimate-linq-with-csharp-masterclass-basics-to-advanced/
Convolutional Neural Networks in Python: CNN Computer Vision,https://www.udemy.com/course/cnn-for-computer-vision-with-keras-and-tensorflow-in-python/
jQuery Crash Course: Learn the Essentials of jQuery Fast,https://www.udemy.com/course/learn-jquery-crash-course/
"NGINX, Apache, SSL Encryption - Certification Course",https://www.udemy.com/course/nginx-apache-ssl-encryption-certification-course/
Ultimate Rust 2: Intermediate Concepts,https://www.udemy.com/course/ultimate-rust-2/
ASP.NET CORE WEB API | The Complete Guide,https://www.udemy.com/course/the-complete-guide-to-aspnet-web-api/
Learn Robot Framework (Selenium) from Industry Expert|22+hr,https://www.udemy.com/course/robot-python/
AWS CodePipeline Step by Step,https://www.udemy.com/course/aws-codepipeline-step-by-step/
C# Advanced Topics - The Next Logical Step,https://www.udemy.com/course/csharp-advanced-topics-the-linq-lambda-delegates-events/
Cucumber BDD with Python Behave and Selenium WebDriver 2023,https://www.udemy.com/course/bdd-testing-with-python/
"The Complete Flutter App Development Course for Android, iOS",https://www.udemy.com/course/the-complete-flutter-app-development-course-for-android-ios/
Try Udemy Business,https://www.udemy.com/udemy-business/request-demo-mx/?ref=right-rail&locale=en_US
Mathematical Foundation For Machine Learning and AI,https://www.udemy.com/course/mathematical-foundation-for-machine-learning-and-ai/
Dependency Injection in C# and .NET with the Autofac Library,https://www.udemy.com/course/di-ioc-dotnet/
HTML - Introduction to HTML Web Development,https://www.udemy.com/course/intro-to-html-web-development/
How to Make Tile Based Platform Games in Gamemaker,https://www.udemy.com/course/how-to-make-tile-based-platform-games-with-gamemaker/
Learn To Code Trading Card Game Battle System With Unity 3D,https://www.udemy.com/course/learn-to-code-trading-card-game-battle-system-with-unity-3d/
REST Assured Fundamentals 2022,https://www.udemy.com/course/rest-assured-fundamentals/
Software Architecture: Meta and SOLID Principles in C#,https://www.udemy.com/course/solid-principles/
ArcPy for Python Developers using ArcGIS Pro,https://www.udemy.com/course/arcpy-for-python-developers/
Python for Beginners - Go from Java to Python in 100 Steps,https://www.udemy.com/course/learn-python-programming-for-java-programmers/
Python For Beginners - Python Bootcamp - Python Programming,https://www.udemy.com/course/python-for-those-absolute-beginners-who-never-programmed/
RESTful API with Laravel: Build a Real API with Laravel,https://www.udemy.com/course/restful-api-with-laravel-php-homestead-passport-hateoas/
The Complete Oracle APEX Fundamentals Course (2023),https://www.udemy.com/course/oracle-application-express-learn-oracle-apex-201/
Complete Web Developer Course HTML CSS JavaScript PHP jQuery,https://www.udemy.com/course/learn-web-development-complete-step-by-step-guide-to-success/
The Complete Unity Indie Game Developer Course,https://www.udemy.com/course/the-complete-unity-indie-game-developer-course/
Learn C# With Windows Forms and SQL Server,https://www.udemy.com/course/csharp6windowsforms/
"Learn to build an e-commerce store with .Net, React & Redux",https://www.udemy.com/course/learn-to-build-an-e-commerce-store-with-dotnet-react-redux/
Try Udemy Business,https://www.udemy.com/udemy-business/request-demo-mx/?ref=right-rail&locale=en_US
Salesforce Lightning: Learn about Salesforce Lightning,https://www.udemy.com/course/salesforce-lightning-ui/
AWS CloudFormation - Simplified | Hands On with YAML,https://www.udemy.com/course/aws-cloudformation-simplified-hands-on-learning/
AWS Data Architect Bootcamp - 43 Services 500 FAQs 20+ Tools,https://www.udemy.com/course/aws-data-architect-bootcamp-training/
The Creative HTML5 & CSS3 Course - Build Awesome Websites,https://www.udemy.com/course/the-creative-html5-css3-course-build-awesome-websites/
Python for Beginners : Concise and Practical,https://www.udemy.com/course/python-basics-for-the-beginning-enthusiast/
High Performance Coding with .NET Core and C#,https://www.udemy.com/course/high-performance-coding-with-net-core-and-csharp/
"Clean Code with Java: Learn Simple Design, Refactoring & TDD",https://www.udemy.com/course/java-clean-code-with-refactoring-and-tdd/
"Multithreading,Parallel & Asynchronous Coding in Modern Java",https://www.udemy.com/course/parallel-and-asynchronous-programming-in-modern-java/
Java Spring Security,https://www.udemy.com/course/how-to-use-spring-security-to-secure-your-java-applications/
The Essential Web Developer Course - Build 12 Websites,https://www.udemy.com/course/the-essential-web-developer-course/
End to End automation testing with Cypress,https://www.udemy.com/course/e2e-cypress/
Automated Software Testing with Playwright,https://www.udemy.com/course/automated-software-testing-with-playwright/
Unity Game Development: Make Professional 3D Games,https://www.udemy.com/course/unity-game-development-make-professional-3d-games/
Learning Visual Basic .NET - A Guide To VB.NET Programming,https://www.udemy.com/course/learning-visual-basic-net/
Java Programming: Step by Step from A to Z,https://www.udemy.com/course/java-programming-step-by-step-from-a-to-z/
Projects in Laravel: Learn Laravel Building 10 Projects,https://www.udemy.com/course/projects-in-laravel-learn-laravel-building-10-projects/
Try Udemy Business,https://www.udemy.com/udemy-business/request-demo-mx/?ref=right-rail&locale=en_US
Mobile App Design from scratch with Sketch 3 : UX and UI,https://www.udemy.com/course/mobile-app-design-from-scratch/
Angular Security Masterclass (with FREE E-Book),https://www.udemy.com/course/angular-security/
"Responsive Web & Mobile Development in HTML,CSS & Javascript",https://www.udemy.com/course/complete-web-development-with-html-css-and-javascript/
Advanced React For Enterprise: React for senior engineers,https://www.udemy.com/course/react-for-senior-engineers/
[NEW] Building Microservices with Spring Boot & Spring Cloud,https://www.udemy.com/course/building-microservices-with-spring-boot-and-spring-cloud/
Learn Flutter and Dart to create Android and IOS apps,https://www.udemy.com/course/learn-flutter-in-30-days/
Ultimate Unity Overview (60+ Tools and Features Explained!),https://www.udemy.com/course/ultimate-unity-overview/
ChatGPT Complete Course - Learn ChatGPT & Prompt Engineering,https://www.udemy.com/course/chat-gpt/
PHP for Beginners: PHP Crash Course 2023,https://www.udemy.com/course/learn-php-for-beginners-php-crash-course-2021/
SQL Server High Availability and Disaster Recovery (HA/DR),https://www.udemy.com/course/sqlserverhadrdeepdive/
MATLAB onramp: Learn scientific coding with ChatGPT's help,https://www.udemy.com/course/matlab-programming-mxc/
Java Collections from basics to Advanced,https://www.udemy.com/course/collections-and-concurrent-collection-video-lectures-and-tutorials/
How to Make a Freaking iPhone App - iOS 10 and Swift 3,https://www.udemy.com/course/how-to-make-a-freaking-iphone-app-ios-10-swift-3-xcode-8/
Build REST API with Spring Boot & Spring Data JPA,https://www.udemy.com/course/rest-api-with-java-spring-boot-spring-data-jpa-jparepository-swagger/
The Result-Oriented Web Developer Course - BOOTCAMP 2023,https://www.udemy.com/course/result-oriented-web-developer-course/
Build Undetectable Malware Using C Language: Ethical Hacking,https://www.udemy.com/course/build-undetectable-malware-using-c-language-ethical-hacking/
Try Udemy Business,https://www.udemy.com/udemy-business/request-demo-mx/?ref=right-rail&locale=en_US
Mobile Testing Masterclass (2023) From The Beginning,https://www.udemy.com/course/mobile-testing-masterclass-from-the-beginning/
Learning Linux Essentials: Taking your first steps in Linux,https://www.udemy.com/course/learning-linux-essentials-taking-your-first-steps-in-linux/
[2023] Machine Learning and Deep Learning Bootcamp in Python,https://www.udemy.com/course/introduction-to-machine-learning-in-python/
Software Engineer Interview Unleashed,https://www.udemy.com/course/software-engineer-interview-unleashed/
Introduction to QA Software Testing Professionalism,https://www.udemy.com/course/introduction-to-sw-qa-testing-professionalism/
"Node, SQL, & PostgreSQL - Mastering Backend Web Development",https://www.udemy.com/course/node-postgresql/
Advanced Object Oriented Analysis of Hard Problems using UML,https://www.udemy.com/course/advanced-object-oriented-analysis-of-hard-problems/
Running a Mobile App Dev Business: The Complete Guide,https://www.udemy.com/course/the-complete-guide-to-running-a-mobile-app-dev-business/
CSS3 Ultimate Guide,https://www.udemy.com/course/the-complete-css-course/
Katalon Studio Beginners - Hands-on Training,https://www.udemy.com/course/katalon-studio-beginners-hands-on-training/
Python 101,https://www.udemy.com/course/kypython-101/
The Complete Quantum Computing Course,https://www.udemy.com/course/quantum-computers/
Android Jetpack masterclass in Kotlin,https://www.udemy.com/course/androidjetpack/
The Complete C Programming Bootcamp,https://www.udemy.com/course/the-complete-c-programming-bootcamp/
Laravel 8 PHP Framework A - Z Build Professional Ecommerce,https://www.udemy.com/course/laravel-framework-build-professional-ecommerce/
ASP.NET Core - SOLID and Clean Architecture,https://www.udemy.com/course/aspnet-core-solid-and-clean-architecture-net-5-and-up/
Try Udemy Business,https://www.udemy.com/udemy-business/request-demo-mx/?ref=right-rail&locale=en_US
The Complete Guide to HTML,https://www.udemy.com/course/the-complete-guide-to-html/
Build Responsive Real World Websites with CSS3 v2.0,https://www.udemy.com/course/css3-responsive-web-design-tutorial-with-flexbox-and-animations/
Efficient Java Multithreading and Concurrency with Executors,https://www.udemy.com/course/efficient-java-multithreading-with-executors/
How To Write Bulletproof Multi-Threaded C# Code,https://www.udemy.com/course/how-to-write-multi-threaded-csharp-code/
Become a Hadoop Developer |Training|Tutorial,https://www.udemy.com/course/hadoop-tutorial/
Vue JS 2: From Beginner to Professional (includes Vuex),https://www.udemy.com/course/vuejs-from-beginner-to-professional/
.NET Core Microservices,https://www.udemy.com/course/net-core-microservices/
Deep Reinforcement Learning 2.0,https://www.udemy.com/course/deep-reinforcement-learning/
Learn XML Crash Course: Discover Essential XML Fundamentals,https://www.udemy.com/course/learn-xml-crash-course/
React Styled Components Course (V5),https://www.udemy.com/course/styled-components-tutorial-and-project-course/
"Complete Web Development Course: HTML, Vue.js, PHP, MySQL",https://www.udemy.com/course/web-development-html5-css3-php-oop-and-mysql-database/
Game Physics - Introducing Gravitation & Rotation in Unity,https://www.udemy.com/course/gamephysics/
ChatBots: How to Make a Facebook Messenger Chat Bot in 1hr,https://www.udemy.com/course/chatbots-how-to-make-chat-bot-for-facebook-messenger/
HTML5 Essentials for Beginners,https://www.udemy.com/course/html5-essentials-for-beginners/
Asynchronous JavaScript,https://www.udemy.com/course/asynchronous-javascript/
Angular Advanced MasterClass & FREE E-Book,https://www.udemy.com/course/angular-advanced-masterclass/
Try Udemy Business,https://www.udemy.com/udemy-business/request-demo-mx/?ref=right-rail&locale=en_US
UML Class Diagrams for Programmers,https://www.udemy.com/course/uml-class-diagrams-for-programmers/
Electron From Scratch: Build Desktop Apps With JavaScript,https://www.udemy.com/course/electron-from-scratch/
Modern Artificial Intelligence with Zero Coding,https://www.udemy.com/course/modern-artificial-intelligence-with-zero-coding/
Design Patterns for Game Programming,https://www.udemy.com/course/design-patterns-for-game-programming/
"Build Modern Responsive Website With HTML5, CSS3 & Bootstrap",https://www.udemy.com/course/build-modern-responsive-website-with-html5-css3-bootstrap/
How to Install a Free SSL Certificate using Let's Encrypt,https://www.udemy.com/course/fix-googles-new-not-secure-warning-with-lets-encrypt/
U&P AI - Natural Language Processing (NLP) with Python,https://www.udemy.com/course/understand-and-practice-ai-natural-language-processing-in-python/
C# / .NET Interview Questions with Answers.,https://www.udemy.com/course/csharp-interview-questions-answers/
Autonomous Cars: Deep Learning and Computer Vision in Python,https://www.udemy.com/course/autonomous-cars-deep-learning-and-computer-vision-in-python/
CSS Bootcamp - Master CSS (CSS Grid / CSS Flexbox),https://www.udemy.com/course/css-bootcamp-master-in-css-including-css-grid-flexbox/
Swift 5 Programming For Beginners,https://www.udemy.com/course/swift-programming/
Python & Cryptocurrency API: Build 5 Real World Applications,https://www.udemy.com/course/coinmarketcap/
SAP PI / SAP PO: Interface Development with Standard Adapter,https://www.udemy.com/course/sap-po-interface-development-training-with-standard-adapter/
The HTML & CSS Bootcamp 2023 Edition,https://www.udemy.com/course/html-and-css-bootcamp/
Learn Restful Api's with Asp.Net Core 5.0 2022,https://www.udemy.com/course/learn-restful-apis-with-aspnet-core-5/
Hibernate: Advanced Development Techniques,https://www.udemy.com/course/hibernate-tutorial-advanced/
Try Udemy Business,https://www.udemy.com/udemy-business/request-demo-mx/?ref=right-rail&locale=en_US
Assembly Language Adventures: Complete Course,https://www.udemy.com/course/x86-asm-foundations/
Java Programming Masterclass: Learn Java From Scratch,https://www.udemy.com/course/java-programming-course/
Learn MongoDB & Neo4j - Leading NoSQL Databases from scratch,https://www.udemy.com/course/learn-mongodb-leading-nosql-database-from-scratch/
Learn Machine learning & AI (Including Hands-on 3 Projects),https://www.udemy.com/course/machine-learning-and-ai-with-hands-on-projects/
ASP.NET Core 6 Identity and Security (SECOND EDITION),https://www.udemy.com/course/aspnet-core-2-security-and-identity-management-with-c/
Using MySQL Databases With Python,https://www.udemy.com/course/using-mysql-databases-with-python/
Regression Analysis / Data Analytics in Regression,https://www.udemy.com/course/regression-statistics/
"REST Assured API Automation,Allure Reports - An Introduction",https://www.udemy.com/course/rest-api-testing-with-rest-assuredpostman-part1/
Learn To Create A Roguelike Game In Unity,https://www.udemy.com/course/unityroguelike/
Querying Microsoft SQL Server 2012 - (Exam No. 70-461),https://www.udemy.com/course/querying-sql-server-2012-70-461/
Quality Assurance Mastery - Manual Software Testing,https://www.udemy.com/course/quality-assurance-manual/
Build Microservices with .NET & Amazon Web Services,https://www.udemy.com/course/build-microservices-with-aspnet-core-amazon-web-services/
Java For Everyone - Zero to Hero,https://www.udemy.com/course/java-for-everyone-zero-to-hero/
React Testing Library and Jest: The Complete Guide,https://www.udemy.com/course/react-testing-library-and-jest/
Machine Learning & Data Science A-Z: Hands-on Python 2023,https://www.udemy.com/course/data-science-machine-learning-a-z-hands-on-python/
Train YOLO for Object Detection with Custom Data,https://www.udemy.com/course/training-yolo-v3-for-objects-detection-with-custom-data/
Try Udemy Business,https://www.udemy.com/udemy-business/request-demo-mx/?ref=right-rail&locale=en_US
Professional WordPress Theme & Plugin Development,https://www.udemy.com/course/photoshop-psd-to-wordpress-theme-development-from-scratch/
Python & Introduction to Data Science,https://www.udemy.com/course/python-introduction-to-data-science/
Optimization with Python: Solve Operations Research Problems,https://www.udemy.com/course/optimization-with-python-linear-nonlinear-and-cplex-gurobi/
Unity Tech Art: Realistic Lighting For Game Development,https://www.udemy.com/course/lighting-in-unity/
Creating a Responsive HTML Email,https://www.udemy.com/course/creating-responsive-html-email/
"Modern Android app using Kotlin, MVVM, Dagger2, RxJava &more",https://www.udemy.com/course/modernandroid/
Complete Next.js with React & Node - Beautiful Portfolio App,https://www.udemy.com/course/awesome-nextjs-with-react-and-node-amazing-portfolio-app/
Oracle Certification: Mastering Java for Beginners & Experts,https://www.udemy.com/course/java-series/
"Modern Computer Vision™ PyTorch, Tensorflow2 Keras & OpenCV4",https://www.udemy.com/course/modern-computer-vision/
The Advanced SQL Course,https://www.udemy.com/course/the-advanced-sql-course-2021/
Symfony API Platform with React Full Stack Masterclass,https://www.udemy.com/course/symfony-api-platform-reactjs-full-stack-masterclass/
Kubernetes On The Cloud & The CNCF CKA Certification,https://www.udemy.com/course/kubernetes-cka-on-cloud/
Git & Github Master Course(2022),https://www.udemy.com/course/git-github-master-course/
The Complete Quality Assurance Course- Learn QA from Scratch,https://www.udemy.com/course/the-complete-quality-assurance/
TDD in C# From A to Z,https://www.udemy.com/course/tdd-csharp/
Data Structures and Algorithms In C,https://www.udemy.com/course/data-structures-and-algorithms-in-c/
Try Udemy Business,https://www.udemy.com/udemy-business/request-demo-mx/?ref=right-rail&locale=en_US
SOFTWARE TESTING MASTERCLASS-2023-JIRA | AGILE | API Testing,https://www.udemy.com/course/software-manualtesting/
JavaScript Interview Prep: Practice Problems,https://www.udemy.com/course/javascript-interview-prep/
CSS Complete Course For Beginners,https://www.udemy.com/course/css-complete-course-for-beginners/
Kotlin Coroutines for Android Masterclass,https://www.udemy.com/course/kotlin-coroutines-in-android/
Programming the Arduino - Getting Started,https://www.udemy.com/course/arduino-programming-for-beginners/
"SwiftUI - Learn How to Build Beautiful, Robust, Apps",https://www.udemy.com/course/swiftui-course/
Beginning Laravel (2023) - From Novice to Professional,https://www.udemy.com/course/laravel-blog-development/
SVG & CSS Animation - Using HTML & CSS,https://www.udemy.com/course/svg-animation/
Python for Data Science and Machine Learning beginners,https://www.udemy.com/course/python-for-data-science-and-machine-learning-beginners/
Data Management Masterclass - The Complete Course,https://www.udemy.com/course/data-management-masterclass-the-complete-course/
Learn To Create WordPress Themes By Building 10 Projects,https://www.udemy.com/course/learn-to-create-wordpress-themes-by-building-10-projects/
Learn BERT - most powerful NLP algorithm by Google,https://www.udemy.com/course/bert-nlp-algorithm/
Spring Boot For Software Engineers,https://www.udemy.com/course/spring-boot-for-software-engineers/
How To Make A Wordpress Website - Divi Theme Tutorial,https://www.udemy.com/course/how-to-make-a-wordpress-website-2018-divi-theme-tutorial/
Unity & C# - Build A Complete 2D Mobile Platformer Game,https://www.udemy.com/course/unity-2d-course-build-a-mobile-platformer-game-from-scratch/
"Build Realtime Apps | React Js, Golang & RethinkDB",https://www.udemy.com/course/realtime-apps-with-reactjs-golang-rethinkdb/
Try Udemy Business,https://www.udemy.com/udemy-business/request-demo-mx/?ref=right-rail&locale=en_US
Learn SSRS SQL Reporting & Business Intelligence Essentials,https://www.udemy.com/course/exploring-ssrs-creating-great-reports/
ASP.NET CORE MVC | Build a Complete eCommerce App,https://www.udemy.com/course/complete-ecommerce-aspnet-mvc-application/
Complete Microsoft SQL Server Masterclass:Beginner to Expert,https://www.udemy.com/course/complete-microsoft-sql-masterclass-beginner-advanced/
Salesforce Visualforce Development: Create Visualforce pages,https://www.udemy.com/course/learn-salesforce-visualforce-step-by-step/
The 7 Day Android App Bootcamp - Android Pie and Kotlin,https://www.udemy.com/course/android-apps/
The Java Design Patterns Course,https://www.udemy.com/course/java-design-patterns-course/
Web Security and Hacking for Beginners,https://www.udemy.com/course/one-month-web-security/
Automated Software Testing with WebdriverIO,https://www.udemy.com/course/automated-software-testing-with-webdriverio/
Probability for Statistics and Data Science,https://www.udemy.com/course/probability-for-statistics-and-data-science/
"Coding for Entrepreneurs: Learn Python, Django, and More.",https://www.udemy.com/course/coding-for-entrepreneurs/
jQuery for Beginners - Create Website Animations Easily,https://www.udemy.com/course/jquery-for-beginners-fundamentals-training-tutorial-course/
Selenium Python - Step by Step for Beginners with Framework,https://www.udemy.com/course/selenium-python-step-by-step-for-beginners/
Master Python programming by solving scientific projects,https://www.udemy.com/course/python-scientific-x/
Automated Software Testing with Puppeteer,https://www.udemy.com/course/automated-headless-browser-testing-with-puppeteer/
The Complete Kotlin Developer Course,https://www.udemy.com/course/the-complete-kotlin-developer-course-java/
JavaScript Game Development: Create Your Own Breakout Game,https://www.udemy.com/course/javascript-game-development-create-your-own-breakout-game/
Try Udemy Business,https://www.udemy.com/udemy-business/request-demo-mx/?ref=right-rail&locale=en_US
Angular Router In Depth (Angular 16),https://www.udemy.com/course/angular-router-course/
ANGULAR and ASP.NET Core REST API - Real World Application,https://www.udemy.com/course/real-world-app-angular-aspnet-core-web-api-and-sql/
Learn PHP Programming From Scratch,https://www.udemy.com/course/learn-php-programming-from-scratch/
CSS Crash Course For Beginners,https://www.udemy.com/course/css-crash-course-for-beginners-g/
Bootstrap 4 Beginners: Code a Responsive Landing Page,https://www.udemy.com/course/bootstrap-4-beginners-code-a-responsive-landing-page/
Mastering ASP.NET MVC 5 From Scratch Using C#,https://www.udemy.com/course/masteringaspnetmvc5/
Unity Turn-Based Strategy Game: Intermediate C# Coding,https://www.udemy.com/course/unity-turn-based-strategy/
WordPress for Absolute Beginners,https://www.udemy.com/course/wordpress-for-absolute-beginners-course/
Salesforce Lightning Framework,https://www.udemy.com/course/salesforce-lightning-framework/
How to design & develop REST microservices in Golang (Go),https://www.udemy.com/course/golang-how-to-design-and-build-rest-microservices-in-go/
"Learn By Example: Hadoop, MapReduce for Big Data problems",https://www.udemy.com/course/learn-by-example-hadoop-mapreduce/
CS101 Bootcamp: Introduction to Computer Science & Software,https://www.udemy.com/course/cs101-introduction-to-computer-science/
Get Expertise in Database Testing(SQL) + Linux for Testers,https://www.udemy.com/course/sql-for-testers/
